,Title,Year,Authors,Journal,Journal Acronym,Rank
128,From the Perspective of CNN to Adversarial Iris Images.,2018,"Yi Huang, Adams Wai-Kin Kong, Kwok-Yan Lam",BTAS 2018: 1-10,BTAS,Unranked
129,Using Blockchain to Control Access to Cloud Data.,2018,"Jiale Guo, Wenzhuo Yang, Kwok-Yan Lam, Xun Yi",Inscrypt 2018: 274-288,CISC,Unranked
130,A Comparative Study of Transactional and Semantic Approaches for Predicting Cascades on Twitter.,2018,"Yunwei Zhao, Can Wang, Chi-Hung Chi, Kwok-Yan Lam, Sen Wang",IJCAI 2018: 1212-1218,IJCAI,A*
131,Efficient and Lightweight Quantized Compressive Sensing using μ-Law.,2018,"Vikramkumar Pudi, Anupam Chattopadhyay, Kwok-Yan Lam",ISCAS 2018: 1-5,ISCAS,Unranked
132,BLIC: A Blockchain Protocol for Manufacturing and Supply Chain Management of ICS.,2018,"Sumanta Bose, Mayank Raikwar, Debdeep Mukhopadhyay, Anupam Chattopadhyay, Kwok-Yan Lam",iThings/GreenCom/CPSCom/SmartData 2018: 1326-1335,ITHINGS,Unranked
133,A Blockchain Framework for Insurance Processes.,2018,"Mayank Raikwar, Subhra Mazumdar, Sushmita Ruj, Sourav Sen Gupta, Anupam Chattopadhyay, Kwok-Yan Lam",NTMS 2018: 1-4,NTMS,C
134,Autonomous Vehicle: Security by Design.,2018,"Anupam Chattopadhyay, Kwok-Yan Lam",CoRR abs/1810.00545 ,CORR,Unranked
135,A New Blind ECDSA Scheme for Bitcoin Transaction Anonymity.,2018,"Xun Yi, Kwok-Yan Lam, Dieter Gollmann",IACR Cryptol. ePrint Arch. 2018: 660 ,IACR,Unranked
136,Security of autonomous vehicle as a cyber-physical system.,2017,"Anupam Chattopadhyay, Kwok-Yan Lam",ISED 2017: 1-6,ISED,Unranked
137,Survey of secure processors.,2017,"Suman Sau, Jawad Haj-Yahya, Ming Ming Wong, Kwok-Yan Lam, Anupam Chattopadhyay",SAMOS 2017: 253-260,SAMOS,Unranked
138,Identity in the Internet-of-Things (IoT): New Challenges and Opportunities.,2016,"Kwok-Yan Lam, Chi-Hung Chi",ICICS 2016: 18-26,ICICS,C
139,"Information and Communications Security - 18th International Conference, ICICS 2016, Singapore, November 29 - December 2, 2016, Proceedings.",2016,"Kwok-Yan Lam, Chi-Hung Chi, Sihan Qing","Lecture Notes in Computer Science 9977, Springer 2016, ISBN 978-3-319-50010-2 ",ICICS,C
140,Obtaining more Karatsuba-like formulae over the binary field.,2012,"Haining Fan, Ming Gu, Jiaguang Sun, Kwok-Yan Lam",IET Inf. Secur. 6: 14-19 ,IET-IFS,Unranked
141,Energy-Efficient Key Distribution Using Electrocardiograph Biometric Set for Secure Communications in Wireless Body Healthcare Networks.,2011,"Jinyang Shi, Kwok-Yan Lam, Ming Gu, Mingze Li, Siu Leung Chung",J. Medical Syst. 35: 745-753 ,JMS,Unranked
142,Ubiquitous and Secure Certificate Service for Wireless Ad Hoc Network.,2010,"Meng Ge, Kwok-Yan Lam, Jian-Bin Li, Siu Leung Chung",IEICE Trans. Inf. Syst. 93-D: 1848-1856 ,IEICET,Unranked
143,Overlap-free Karatsuba-Ofman polynomial multiplication algorithms.,2010,"Haining Fan, Jia-Guang Sun, Ming Gu, Kwok-Yan Lam",IET Inf. Secur. 4: 8-14 ,IET-IFS,Unranked
144,Trust Based Routing for Misbehavior Detection in Ad Hoc Networks.,2010,"Wei Gong, Zhiyang You, Danning Chen, Xibin Zhao, Ming Gu, Kwok-Yan Lam",J. Networks 5: 551-558 ,JNW,Unranked
145,BodySec: synchronized key distribution using biometric slots for wireless body sensor networks.,2010,"Jinyang Shi, Kwok-Yan Lam, Ming Gu, Husheng Li",ACM SIGMOBILE Mob. Comput. Commun. Rev. 14: 22-24 ,SIGMOBILE,Unranked
146,Selection Policy of Rescue Servers Based on Workload Characterization of Flash Crowd.,2010,"Chi-Hung Chi, Shijie Xu, Feng-Lin Li, Kwok-Yan Lam",SKG 2010: 293-296,SKG,National
147,A robust certification service for highly dynamic MANET in emergency tasks.,2009,"Meng Ge, Kwok-Yan Lam, Dieter Gollmann, Siu Leung Chung, C. C. Chang, Jian-Bin Li",Int. J. Commun. Syst. 22: 1177-1197 ,IJCOMSYS,Unranked
148,Towards Energy-Efficient Secure Communications Using Biometric Key Distribution in Wireless Biomedical Healthcare Networks.,2009,"Jinyang Shi, Kwok-Yan Lam, Ming Gu, Mingze Li, Siu Leung Chung",BMEI 2009: 1-5,BMEI,Unranked
149,SAODV: A MANET Routing Protocol that can Withstand Black Hole Attack.,2009,"Songbai Lu, Longxuan Li, Kwok-Yan Lam, Lingyan Jia",CIS  2009: 421-425,CIS,C
150,SAODV: A MANET Routing Protocol that can Withstand Black Hole Attack.,2009,"Songbai Lu, Longxuan Li, Kwok-Yan Lam, Lingyan Jia",CIS  2009: 421-425,CIS,National
151,Reusable Set Constructions Using Randomized Dissolvent Templates for Biometric Security.,2009,"Jinyang Shi, Kwok-Yan Lam, Ming Gu, Husheng Li",GLOBECOM 2009: 1-6,GLOBECOM,B
152,MinuCode: A Fixed-Value Representation of Fingerprint Minutiae for Biometric Cryptosystem.,2009,"Jinyang Shi, Kwok-Yan Lam",ISA 2009: 382-391,SERSC-ISA,Unranked
153,Self-initialized Distributed Certificate Authority for Mobile Ad Hoc Network.,2009,"Meng Ge, Kwok-Yan Lam",ISA 2009: 392-401,SERSC-ISA,Unranked
154,Obtaining More Karatsuba-Like Formulae over The Binary Field.,2009,"Haining Fan, Ming Gu, Jiaguang Sun, Kwok-Yan Lam",IACR Cryptol. ePrint Arch. 2009: 636 ,IACR,Unranked
155,Efficient Fingercode Classification.,2008,"Hong-Wei Sun, Kwok-Yan Lam, Dieter Gollmann, Siu Leung Chung, Jian-Bin Li, Jia-Guang Sun",IEICE Trans. Inf. Syst. 91-D: 1252-1260 ,IEICET,Unranked
156,Ubiquitous and Secure Certificate Service for Mobile Ad Hoc Network.,2008,"Meng Ge, Kwok-Yan Lam, Jian-Bin Li, Siu Leung Chung",EUC  2008: 312-317,EUC,C
157,Biomapping: Privacy trustworthy biometrics using noninvertible and discriminable constructions.,2008,"Jinyang Shi, Zhiyang You, Ming Gu, Kwok-Yan Lam",ICPR 2008: 1-4,ICPR,B
158,Robust Remote Authentication for Scalable Web-Based Services.,2008,"Jian-Bin Li, Kwok-Yan Lam, Hong-Wei Sun, Siu Leung Chung",IIH-MSP 2008: 1113-1117,IIH-MSP,Unranked
159,Dynamically Constructing Mixed Pyramid for Fast VQ Encoding.,2007,"Hong-Wei Sun, Kwok-Yan Lam, Jia-Guang Sun, Siu Leung Chung",IIH-MSP 2007: 449-452,IIH-MSP,Unranked
160,A fast and elastic fingerprint matching algorithm using minutiae-centered circular regions.,2007,"Haiyong Chen, Hongwei Sun, Kwok-Yan Lam",SECURWARE 2007: 211-215,SECURWARE,Unranked
161,Overlap-free Karatsuba-Ofman Polynomial Multiplication Algorithms.,2007,"Haining Fan, Jiaguang Sun, Ming Gu, Kwok-Yan Lam",IACR Cryptol. ePrint Arch. 2007: 393 ,IACR,Unranked
162,Minimal Threshold Closure.,2006,"Xibin Zhao, Kwok-Yan Lam, Guiming Luo, Siu Leung Chung, Ming Gu",ESORICS 2006: 145-155,ESORICS,A
163,Efficient Discovery of Emerging Frequent Patterns in ArbitraryWindows on Data Streams.,2006,"Xiaoming Jin, Xinqiang Zuo, Kwok-Yan Lam, Jianmin Wang, Jia-Guang Sun",ICDE 2006: 113,ICDE,A*
164,An Efficient Algorithm for Fingercode-Based Biometric Identification.,2006,"Hong-Wei Sun, Kwok-Yan Lam, Ming Gu, Jia-Guang Sun",OTM Workshops  2006: 469-478,OTM,Unranked
165,An ID-based multisignature scheme without reblocking and predetermined signing order.,2005,"Chin-Chen Chang, Iuon-Chang Lin, Kwok-Yan Lam",Comput. Stand. Interfaces 27: 407-413 ,CSI,Unranked
166,Efficient vector quantization using genetic algorithm.,2005,"Hongwei Sun, Kwok-Yan Lam, Siu Leung Chung, Wei-Ming Dong, Ming Gu, Jia-Guang Sun",Neural Comput. Appl. 14: 203-211 ,NCA,B
167,A practical system of keyphrase extraction for web pages.,2005,"Mo Chen, Jian-Tao Sun, Hua-Jun Zeng, Kwok-Yan Lam",CIKM 2005: 277-278,CIKM,A
168,The Impact of Mobility Modeling in Mobile IP Multicast Research.,2005,"Guoliang Xie, Mingwei Xu, Kwok-Yan Lam, Qian Wu",ICCNMC 2005: 295-304,ICCNMC,Unranked
169,An Efficient Anomaly Detection Algorithm for Vector-Based Intrusion Detection Systems.,2005,"Hong-Wei Sun, Kwok-Yan Lam, Siu Leung Chung, Ming Gu, Jia-Guang Sun",ICCNMC 2005: 817-825,ICCNMC,Unranked
170,Secure Construction of Virtual Organizations in Grid Computing Systems.,2005,"Bangyu Wu, Kwok-Yan Lam, Siu Leung Chung, Huaxiong Wang",WINE 2005: 959-968,WINE,Unranked
171,Authorization Mechanisms for Virtual Organizations in Distributed Computing Systems.,2004,"Xibin Zhao, Kwok-Yan Lam, Siu Leung Chung, Ming Gu, Jia-Guang Sun",ACISP 2004: 414-426,ACISP,Australasian B
172,Real-Time Emulation of Intrusion Victim in HoneyFarm.,2004,"Xing-Yun He, Kwok-Yan Lam, Siu Leung Chung, Chi-Hung Chi, Jia-Guang Sun",AWCC 2004: 143-154,AWCC,Unranked
173,Enhancing the Scalability of the Community Authorization Service for Virtual Organizations.,2004,"Jian-Ping Yong, Kwok-Yan Lam, Siu Leung Chung, Ming Gu, Jia-Guang Sun",AWCC 2004: 182-193,AWCC,Unranked
174,Anomaly Detection in Grid Computing Based on Vector Quantization.,2004,"Hong-Wei Sun, Kwok-Yan Lam, Siu Leung Chung, Ming Gu, Jia-Guang Sun",GCC 2004: 883-886,GCC,Unranked
175,Application of Content Computing in Honeyfarm.,2004,"Yi-Yuan Huang, Kwok-Yan Lam, Siu Leung Chung, Chi-Hung Chi, Jia-Guang Sun",WISA 2004: 211-222,WISA,National
176,"Content Computing, Advanced Workshop on Content Computing, AWCC 2004, ZhenJiang, JiangSu, China, November 15-17, 2004, Proceedings.",2004,"Chi-Hung Chi, Kwok-Yan Lam","Lecture Notes in Computer Science 3309, Springer 2004, ISBN 3-540-23898-0 ",AWCC,Unranked
177,Lightweight security for mobile commerce transactions.,2003,"Kwok-Yan Lam, Siu Leung Chung, Ming Gu, Jia-Guang Sun",Comput. Commun. 26: 2052-2060 ,COMCOM,Unranked
178,Security middleware for enhancing interoperability of Public Key Infrastructure.,2003,"Kwok-Yan Lam, Siu Leung Chung, Ming Gu, Jia-Guang Sun",Comput. Secur. 22: 535-546 ,COMPSEC,Unranked
179,On identification secret sharing schemes.,2003,"Ning Cai, Kwok-Yan Lam",Inf. Comput. 184: 298-310 ,IANDC,Unranked
180,Efficient Presentation of Multivariate Audit Data for Intrusion Detection of Web-Based Internet Services.,2003,"Zhi Guo, Kwok-Yan Lam, Siu Leung Chung, Ming Gu, Jia-Guang Sun",ACNS 2003: 63-75,ACNS,B
181,GridFS: A Web-Based Data Grid with P2P Concepts and Writable Replicas.,2003,"Qinghu Li, Jianmin Wang, Kwok-Yan Lam, Jia-Guang Sun",ICADL 2003: 639-642,ICADL,Unranked
182,A Novel Two-Level Trust Model for Grid.,2003,"Tieyan Li, Huafei Zhu, Kwok-Yan Lam",ICICS 2003: 214-225,ICICS,C
183,GridFS: A Web-Based Data Grid for the Distributed Sharing of Educational Resource Files.,2003,"Qinghu Li, Jianmin Wang, Kwok-Yan Lam, Jia-Guang Sun",ICWL 2003: 81-92,ICWL,Unranked
184,Enhancing Grid Security Infrastructure to Support Mobile Computing Nodes.,2003,"Kwok-Yan Lam, Xibin Zhao, Siu Leung Chung, Ming Gu, Jia-Guang Sun",WISA 2003: 42-54,WISA,National
185,An optimal location update and searching algorithm for tracking mobile agent.,2002,"Tieyan Li, Kwok-Yan Lam",AAMAS 2002: 639-646,ATAL,Unranked
186,Detecting anomalous agents in mobile agent system: a preliminary approach.,2002,"Tieyan Li, Kwok-Yan Lam",AAMAS 2002: 655-656,ATAL,Unranked
187,Context Query in Information Retrieval.,2002,"Chi-Hung Chi, Chen (Cherie) Ding, Kwok-Yan Lam",ICTAI 2002: 101-106,ICTAI,B
188,Agent Warehouse: A New Paradigm for Mobile Agent Deployment.,2002,"Chi-Hung Chi, John Sim, Kwok-Yan Lam",ICTAI 2002: 455-462,ICTAI,B
189,Study for Fusion of Different Sources to Determine Relevance.,2002,"Chi-Hung Chi, Chen (Cherie) Ding, Kwok-Yan Lam",ICTAI 2002: 515-520,ICTAI,B
190,Defending against Distributed Denial of Service Attacks Using Resistant Mobile Agent Architecture.,2002,"Tieyan Li, Wai-Meng Chew, Kwok-Yan Lam",IPDPS 2002,IPPS,Unranked
191,Understanding the Object Retrieval Dependence of Web Page Access.,2002,"Chi-Hung Chi, Xiang Li, Kwok-Yan Lam",MASCOTS 2002: 413-420,MASCOTS,B
192,"The Weight Distribution of C5(1, n).",2001,"Kwok-Yan Lam, Francesco Sica",Des. Codes Cryptogr. 24: 181-191 ,DCC,B
193,Decomposing Attacks on Asymmetric Cryptography Based on Mapping Compositions.,2001,"Dingfeng Ye, Zongduo Dai, Kwok-Yan Lam",J. Cryptol. 14: 137-150 ,JOC,Unranked
194,A Secure Group Solution for Multi-Agent EC System.,2001,"Tieyan Li, Kwok-Yan Lam",IPDPS 2001: 169,IPPS,Unranked
195,Duadic sequences of prime lengths.,2000,"Cunsheng Ding, Tor Helleseth, Kwok-Yan Lam",Discret. Math. 218: 33-49 ,DM,C
196,Constructions of authentication codes from algebraic curves over finite fields.,2000,"Chaoping Xing, Huaxiong Wang, Kwok-Yan Lam",IEEE Trans. Inf. Theory 46: 886-892 ,TIT,Unranked
197,A fast algorithm for determining the linear complexity of a sequence with period pn over GF(q).,2000,"Guozhen Xiao, Shimin Wei, Kwok-Yan Lam, Kyoki Imamura",IEEE Trans. Inf. Theory 46: 2203-2206 ,TIT,Unranked
198,On Multiplicative Secret Sharing Schemes.,2000,"Huaxiong Wang, Kwok-Yan Lam, Guozhen Xiao, Huanhui Zhao",ACISP 2000: 342-351,ACISP,Australasian B
199,Loyalty Program Scheme for Anonymous Payment System.,2000,"Arrianto Mukti Wibowo, Kwok-Yan Lam, Gary S. H. Tan",EC-Web 2000: 253-265,ECWEB,Unranked
200,A Secure Route Structure for Information Gathering Agent.,2000,"Tieyan Li, Chuk-Yang Seng, Kwok-Yan Lam",PRIMA 2000: 101-114,PRIMA,B
201,A New Construction of Algebraic Geometry Codes.,1999,"Harald Niederreiter, Chaoping Xing, Kwok-Yan Lam",Appl. Algebra Eng. Commun. Comput. 9: 373-381 ,AAECC,Unranked
202,Securing digital signatures for non-repudiation.,1999,"Jianying Zhou, Kwok-Yan Lam",Comput. Commun. 22: 710-716 ,COMCOM,Unranked
203,Construction and Enumeration of All Binary Duadic Codes of Length pm.,1999,"Cunsheng Ding, Kwok-Yan Lam, Chaoping Xing",Fundam. Informaticae 38: 149-161 ,FUIN,Unranked
204,Scalable Threshold Closure.,1999,"Chunru Zhang, Kwok-Yan Lam, Sushil Jajodia",Theor. Comput. Sci. 226: 185-206 ,TCS,Unranked
205,Constructions of Algebraic-Geometry Codes.,1999,"Chaoping Xing, Harald Niederreiter, Kwok-Yan Lam",IEEE Trans. Inf. Theory 45: 1186-1193 ,TIT,Unranked
206,Sequences with Almost Perfect Linear Complexity Profiles and Curves Over Finite Fields.,1999,"Chaoping Xing, Kwok-Yan Lam",IEEE Trans. Inf. Theory 45: 1267-1270 ,TIT,Unranked
207,A generalization of algebraic-geometry codes.,1999,"Chaoping Xing, Harald Niederreiter, Kwok-Yan Lam",IEEE Trans. Inf. Theory 45: 2498-2501 ,TIT,Unranked
208,Several classes of binary sequences with three-level autocorrelation.,1999,"Cunsheng Ding, Tor Helleseth, Kwok-Yan Lam",IEEE Trans. Inf. Theory 45: 2606-2612 ,TIT,Unranked
209,A Class of Explicit Perfect Multi-sequences.,1999,"Chaoping Xing, Kwok-Yan Lam, Zhenghong Wei",ASIACRYPT 1999: 299-305,ASIACRYPT,A
210,Secure Agent-Mediated Auctionlike Negotiation Protocol for Internet Retail Commerce.,1999,"Xiao Feng Wang, Kwok-Yan Lam, Xun Yi, C. Q. Zhang, Eiji Okamoto",CIA 1999: 291-302,CIA,Unranked
211,"Cryptanalysis of ""2 R"" Schemes.",1999,"Dingfeng Ye, Kwok-Yan Lam, Zong-Duo Dai",CRYPTO 1999: 315-325,CRYPTO,A*
212,A New Approach to Robust Threshold RSA Signature Schemes.,1999,"Reihaneh Safavi-Naini, Huaxiong Wang, Kwok-Yan Lam",ICISC 1999: 184-196,ICISC,National
213,Mobile IP Registration Protocol: A Security Attack and New Secure Minimal Public-Key Based Authentication.,1999,"Sufatrio, Kwok-Yan Lam",ISPAN 1999: 364-369,ISPAN,Unranked
214,Internet Mobility Support Optimized for Client Access and its Scalable Authentication Framework.,1999,"Sufatrio, Kwok-Yan Lam",MDA 1999: 220-229,MDA,Unranked
215,A Secure Pay-per View Scheme for Web-Based Video Service.,1999,"Jianying Zhou, Kwok-Yan Lam",Public Key Cryptography 1999: 315-326,PKC,B
216,Agent-based copyright protection architecture for online electronic publishing.,1999,"Xun Yi, S. Kitazawa, Eiji Okamoto, Xiao Feng Wang, Kwok-Yan Lam, S. Tu",Security and Watermarking of Multimedia Contents 1999: 484-493,SSWMC,Unranked
217,"Advances in Cryptology - ASIACRYPT '99, International Conference on the Theory and Applications of Cryptology and Information Security, Singapore, November 14-18, 1999, Proceedings.",1999,"Kwok-Yan Lam, Eiji Okamoto, Chaoping Xing","Lecture Notes in Computer Science 1716, Springer 1999, ISBN 3-540-66666-4 ",ASIACRYPT,A
218,On the efficient implementation of fair non-repudiation.,1998,"Cheng-Hwee You, Jianying Zhou, Kwok-Yan Lam",Comput. Commun. Rev. 28: 50-60 ,CCR,Unranked
219,An optimized protocol for mobile network authentication and security.,1998,"Xun Yi, Eiji Okamoto, Kwok-Yan Lam",ACM SIGMOBILE Mob. Comput. Commun. Rev. 2: 37-39 ,SIGMOBILE,Unranked
220,Differential Cryptanalysis of a Block Cipher.,1998,"Xun Yi, Kwok-Yan Lam, Yongfei Han",ACISP 1998: 58-67,ACISP,Australasian B
221,Weak Invertibiity of Finite Automata and Cryptanalysis on FAPKC.,1998,"Zong-Duo Dai, Dingfeng Ye, Kwok-Yan Lam",ASIACRYPT 1998: 227-241,ASIACRYPT,A
222,RSA Signature Algorithm for Microcontroller Implementation.,1998,"Guopei Qiao, Kwok-Yan Lam",CARDIS 1998: 353-356,CARDIS,C
223,Secure Information Gathering Agent for Internet Trading.,1998,"Xiao Feng Wang, Xun Yi, Kwok-Yan Lam, Eiji Okamoto",DAI 1998: 183-193,DAI,Unranked
224,A Secure Intelligent Trade Agent System.,1998,"Xun Yi, Xiao Feng Wang, Kwok-Yan Lam",Trends in Distributed Systems for Electronic Commerce 1998: 218-228,IFIP,Unranked
225,Undeniable Billing in Mobile Communication.,1998,"Jianying Zhou, Kwok-Yan Lam",MobiCom 1998: 284-290,MOBICOM,A*
226,Secure Agent-Mediated Mobile Payment.,1998,"Xiao Feng Wang, Kwok-Yan Lam, Xun Yi",PRIMA 1998: 162-173,PRICAI,B
227,A Security Auction-Like Negotiation Protocol for Agent-Based Internet Trading.,1998,"Xun Yi, Xiao Feng Wang, Kwok-Yan Lam, Eiji Okamoto, D. Frank Hsu",SRDS 1998: 197-203,SRDS,B
228,Global Optimisation in Neural Network Training.,1997,"Lucas Chi Kwong Hui, Kwok-Yan Lam, Chee Weng Chea",Neural Comput. Appl. 5: 58-64 ,NCA,B
229,A New Hash Function Based on Block Cipher.,1997,"Xun Yi, Kwok-Yan Lam",ACISP 1997: 139-146,ACISP,Australasian B
230,A New Byte-Oriented Block Cipher.,1997,"Xun Yi, Kwok-Yan Lam, Shixin Cheng, Xiaohu You",ISW 1997: 209-220,ISW,Unranked
231,Designing a system infrastructure for distributed programs.,1996,"Kwok-Yan Lam, Lucas Chi Kwong Hui",Comput. Commun. 19: 754-762 ,COMCOM,Unranked
232,Efficient nearer-ancestor algorithm for network routing.,1996,"Kwok-Yan Lam, Lucas Chi Kwong Hui",Comput. Commun. 19: 1014-1019 ,COMCOM,Unranked
233,A data reduction method for intrusion detection.,1996,"Kwok-Yan Lam, Lucas Chi Kwong Hui, Siu Leung Chung",J. Syst. Softw. 33: 101-108 ,JSS,Unranked
234,The Failure of Anti-Hacking Legislation: A Hong Kong Perspective.,1996,"Rynson W. H. Lau, Kwok-Yan Lam, Siu Leung Chung",CCS 1996: 62-67,CCS,A*
235,Efficient Generation of Elliptic Curve Cryptosystems.,1996,"Kwok-Yan Lam, San Ling, Lucas Chi Kwong Hui",COCOON 1996: 411-416,COCOON,National
236,Replay tolerance of authentication protocols.,1995,Kwok-Yan Lam,Comput. Commun. 18: 988-992 ,COMCOM,Unranked
237,Multivariate data analysis software for enhancing system security.,1995,"Kwok-Yan Lam, Lucas Chi Kwong Hui, Siu Leung Chung",J. Syst. Softw. 31: 267-275 ,JSS,Unranked
238,Analysis and Experimentation on List Update Algorithms.,1995,"Lucas Chi Kwong Hui, Kwok-Yan Lam",COCOON 1995: 576-581,COCOON,National
239,Context-Dependent Access Control in Distributed Systems.,1993,"Hermann Strack, Kwok-Yan Lam",SEC 1993: 137-155,SEC,Unranked
240,Freshness Assurance of Authentication Protocols.,1992,"Kwok-Yan Lam, Dieter Gollmann",ESORICS 1992: 261-272,ESORICS,A
241,Timely Authentication in Distributed Systems.,1992,"Kwok-Yan Lam, Thomas Beth",ESORICS 1992: 293-303,ESORICS,A
242,A new approach for improving system availability.,1991,Kwok-Yan Lam,"University of Cambridge, UK, 1991",NAN,Unranked
243,An Implementation for Small Databases with High Availability.,1991,Kwok-Yan Lam,ACM SIGOPS Oper. Syst. Rev. 25: 77-87 ,SIGOPS,Unranked
