,Title,Year,Authors,Journal,Journal Acronym,Rank
155,FSSM: Fast Construction of the Optimized Segment Support Map.,2003,"Kok-Leong Ong, Wee Keong Ng, Ee-Peng Lim",DaWaK 2003: 257-266,DAWAK,Unranked
156,Parameterless Data Compression and Noise Filtering Using Association Rule Mining.,2003,"Yew Kwong Woon, Xiang Li, Wee Keong Ng, Wen-Feng Lu",DaWaK 2003: 278-287,DAWAK,Unranked
157,Modelling and Predicting Web Page Accesses Using Markov Processes.,2003,"Devanshu Dhyani, Sourav S. Bhowmick, Wee Keong Ng",DEXA Workshops 2003: 332-336,DEXAW,Unranked
158,A Visual Interface for Native XML Database.,2003,"Khin-Myo Win, Emerald Rosasillfiani, Wee Keong Ng, Ee-Peng Lim",DEXA Workshops 2003: 571-575,DEXAW,Unranked
159,On Querying Geospatial and Georeferenced Metadata Resources in G-Portal.,2003,"Zehua Liu, Ee-Peng Lim, Wee Keong Ng, Dion Hoe-Lian Goh",JCDL 2003: 245-255,JCDL,Unranked
160,A survey of Web metrics.,2002,"Devanshu Dhyani, Wee Keong Ng, Sourav S. Bhowmick",ACM Comput. Surv. 34: 469-503 ,CSUR,Unranked
161,What can a web bag discover for you?,2002,"Sourav S. Bhowmick, Sanjay Madria, Wee Keong Ng",Data Knowl. Eng. 43: 79-119 ,DKE,Unranked
162,Anatomy of the coupling query in a web warehouse.,2002,"Sourav S. Bhowmick, Wee Keong Ng, Sanjay Madria, Ee-Peng Lim",Inf. Softw. Technol. 44: 513-539 ,INFSOF,Unranked
163,Product Schema Integration for Electronic Commerce - A Synonym Comparison Approach.,2002,"Guanghao Yan, Wee Keong Ng, Ee-Peng Lim",IEEE Trans. Knowl. Data Eng. 14: 583-598 ,TKDE,Unranked
164,Constraint-Free Join Processing on Hyperlinked Web Data.,2002,"Sourav S. Bhowmick, Wee Keong Ng, Sanjay Madria, Mukesh K. Mohania",DaWaK 2002: 255-264,DAWAK,Unranked
165,Deriving and Verifying Statistical Distribution of a Hyperlink-Based Web Page Quality Metric.,2002,"Devanshu Dhyani, Sourav S. Bhowmick, Wee Keong Ng",DEXA 2002: 19-28,DEXA,C
166,Web Informetrics: Extending Classical Informetrics to the Web.,2002,"Devanshu Dhyani, Sourav S. Bhowmick, Wee Keong Ng",DEXA Workshops 2002: 351-355,DEXAW,Unranked
167,Modelling and Predicting Web Page Accesses Using Burrell's Model.,2002,"Devanshu Dhyani, Sourav S. Bhowmick, Wee Keong Ng",EC-Web 2002: 172-181,ECWEB,Unranked
168,Wiccap Data Model: Mapping Physical Websites to Logical Views.,2002,"Zehua Liu, Feifei Li, Wee Keong Ng",ER 2002: 120-134,ER,A
169,Personalized Classification for Keyword-Based Category Profiles.,2002,"Aixin Sun, Ee-Peng Lim, Wee Keong Ng",ECDL 2002: 61-74,ERCIMDL,Unranked
170,G-Portal: a map-based digital library for distributed geospatial and georeferenced resources.,2002,"Ee-Peng Lim, Dion Hoe-Lian Goh, Zehua Liu, Wee Keong Ng, Christopher S. G. Khoo, Susan Ellen Higgins",JCDL 2002: 351-358,JCDL,Unranked
171,Mining Relationship Graphs for Effective Business Objectives.,2002,"Kok-Leong Ong, Wee Keong Ng, Ee-Peng Lim",PAKDD 2002: 561-566,PAKDD,B
172,Efficient k Nearest Neighbor Queries on Remote Spatial Databases Using Range Estimation.,2002,"Danzhou Liu, Ee-Peng Lim, Wee Keong Ng",SSDBM 2002: 121-130,SSDBM,B
173,A visual tool for building logical data models of websites.,2002,"Zehua Liu, Wee Keong Ng, Feifei Li, Ee-Peng Lim",WIDM 2002: 92-95,WIDM,Unranked
174,Web classification using support vector machine.,2002,"Aixin Sun, Ee-Peng Lim, Wee Keong Ng",WIDM 2002: 96-99,WIDM,Unranked
175,Online and Incremental Mining of Separately-Grouped Web Access Logs.,2002,"Yew Kwong Woon, Wee Keong Ng, Ee-Peng Lim",WISE 2002: 53-62,WISE,B
176,Evaluating Web Access Log Mining Algorithms: A Cognitive Approach.,2002,"Yew Kwong Woon, Wee Keong Ng, Ee-Peng Lim",WISE Workshops 2002: 217-222,WISE,B
177,"3rd International Conference on Web Information Systems Engineering, WISE 2002, Singapore, December 12-14, 2002, Proceedings.",2002,"Tok Wang Ling, Umeshwar Dayal, Elisa Bertino, Wee Keong Ng, Angela Goh","IEEE Computer Society 2002, ISBN 0-7695-1766-8 ",WISE,B
178,"3rd International Conference on Web Information Systems Engineering Workshops, WISE 2002 Workshops, Singapore, December 11, 2002, Proceedings.",2002,"Bo Huang, Tok Wang Ling, Mukesh K. Mohania, Wee Keong Ng, Ji-Rong Wen, Shyam K. Gupta","IEEE Computer Society 2002, ISBN 0-7695-1813-3 ",WISE,B
179,Schemas for web data: a reverse engineering approach.,2001,"Sourav S. Bhowmick, Wee Keong Ng, Sanjay Madria",Data Knowl. Eng. 39: 105-142 ,DKE,Unranked
180,Ontologies and Electronic Commerce.,2001,"Dieter Fensel, Deborah L. McGuinness, Ellen Schulten, Wee Keong Ng, Ee-Peng Lim, Guanghao Yan",IEEE Intell. Syst. 16: 8-14 ,EXPERT,Unranked
181,Rapid Association Rule Mining.,2001,"Amitabha Das, Wee Keong Ng, Yew Kwong Woon",CIKM 2001: 474-481,CIKM,A
182,Improving the Fairness of Timely Refresh of Web Views.,2001,"Haifeng Liu, Wee Keong Ng, Ee-Peng Lim",DASFAA 2001: 152-153,DASFAA,B
183,Query Integration for Refreshing Web Views.,2001,"Haifeng Liu, Wee Keong Ng, Ee-Peng Lim",DEXA 2001: 557-566,DEXA,C
184,ViDE: A Visual Data Extraction Environment for the Web.,2001,"Yi Li, Wee Keong Ng, Ee-Peng Lim",DEXA 2001: 577-586,DEXA,C
185,On Formulation of Disjunctive Coupling Queries in WHOWEDA.,2001,"Sourav S. Bhowmick, Wee Keong Ng, Sanjay Madria",DEXA 2001: 688-698,DEXA,C
186,Imposing Disjunctive Constraints on Inter-document Structure.,2001,"Sourav S. Bhowmick, Wee Keong Ng, Sanjay Madria",DEXA 2001: 723-733,DEXA,C
187,An Information Concierge for the Web.,2001,"Feifei Li, Zehua Liu, Yangfeng Huang, Wee Keong Ng",DEXA Workshop 2001: 672-676,DEXAW,Unranked
188,Cooperative Multi-Attribute Bilateral Online Negotiation for E-Commerce.,2001,"Lei Zhao, Wee Keong Ng, Ee-Peng Lim",DEXA Workshop 2001: 703-707,DEXAW,Unranked
189,Fast Online Dynamic Association Rule Mining.,2001,"Yew Kwong Woon, Wee Keong Ng, Amitabha Das",WISE  2001: 278-287,WISE,B
190,Data Visualization Operators for WHOWEDA.,2000,"Sourav S. Bhowmick, Sanjay Madria, Wee Keong Ng, Ee-Peng Lim",Comput. J. 43: 364-385 ,CJ,Unranked
191,An Overview of the Agent-Based Electronic Commerce System (ABECOS) Project.,2000,"Ee-Peng Lim, Wee Keong Ng",IEEE Data Eng. Bull. 23: 49-54 ,DEBU,Unranked
192,Heterogeneous product description in electronic commerce.,2000,"Wee Keong Ng, Guanghao Yan, Ee-Peng Lim",SIGecom Exch. 1: 7-13 ,SIGECOM,Unranked
193,Cost-benefit analysis of web bag in a web warehouse: An analytical approach.,2000,"Sourav S. Bhowmick, Sanjay Madria, Wee Keong Ng, Ee-Peng Lim",World Wide Web 3: 165-184 ,WWW,A*
194,Storage Management of a Historical Web Warehousing System.,2000,"Yinyan Cao, Ee-Peng Lim, Wee Keong Ng",DEXA 2000: 457-466,DEXA,C
195,Financial Advisor Agent in a Multi-Agent Financial Trading System.,2000,"Vikrant Pandey, Wee Keong Ng, Ee-Peng Lim",DEXA Workshop 2000: 482-488,DEXAW,Unranked
196,Re-engineering structures from Web documents.,2000,"Chuang-Hue Moh, Ee-Peng Lim, Wee Keong Ng",ACM DL 2000: 67-76,DL,Unranked
197,Web Schemas in WHOMEDA.,2000,"Sourav S. Bhowmick, Wee Keong Ng, Sanjay Madria",DOLAP 2000: 17-24,DOLAP,C
198,Keeping a Very Large Website Up-to-date: Some Feasibility Results.,2000,"Haifeng Liu, Wee Keong Ng, Ee-Peng Lim",EC-Web 2000: 399-408,ECWEB,Unranked
199,On Warehousing Historical Web Information.,2000,"Yinyan Cao, Ee-Peng Lim, Wee Keong Ng",ER 2000: 253-266,ER,A
200,Detecting and Representing Relevant Web Deltas using Web Join.,2000,"Sourav S. Bhowmick, Sanjay Madria, Wee Keong Ng, Ee-Peng Lim",ICDCS 2000: 246-253,ICDCS,A
201,Reducing Cognitive Overheads in a Web Warehouse Using Reverse-Osmosis.,2000,"Sourav S. Bhowmick, Sanjay Madria, Wee Keong Ng, Ee-Peng Lim",ICPADS 2000: 171-178,ICPADS,B
202,eBroker: An Agent-Based Query Routing System for Distributed E-Commerce Databases.,2000,"Yong Lin, Ee-Peng Lim, Wee Keong Ng",ICPADS 2000: 517-522,ICPADS,B
203,Global View Maintenance by Using Inference Relationship among Views.,2000,"Haifeng Liu, Wee Keong Ng, Chaohui Li",Web-Age Information Management 2000: 291-298,WAIM,Unranked
204,DTD-Miner: A Tool for Mining DTD from XML Documents.,2000,"Chuang-Hue Moh, Ee-Peng Lim, Wee Keong Ng",WECWIS 2000: 144-151,WECWIS,Unranked
205,Model and Research Issues for Refreshing a Very Large Website.,2000,"Haifeng Liu, Wee Keong Ng, Ee-Peng Lim",WISE 2000: 291-295,WISE,B
206,Are Life-Like Characteristics Useful for Autonomous Agents?,1999,"Mathew Yap, Wee Keong Ng",Agents 1999: 336-337,AGENTS,Unranked
207,ZBroker: A Query Routing Broker for Z39.50 Databases.,1999,"Yong Lin, Jian Xu, Ee-Peng Lim, Wee Keong Ng",CIKM 1999: 202-209,CIKM,A
208,Pi-Web Join in a Web Warehouse.,1999,"Sourav S. Bhowmick, Sanjay Kumar Madria, Wee Keong Ng, Ee-Peng Lim",DASFAA 1999: 255-262,DASFAA,B
209,Research Issues in Web Data Mining.,1999,"Sanjay Kumar Madria, Sourav S. Bhowmick, Wee Keong Ng, Ee-Peng Lim",DaWaK 1999: 303-312,DAWAK,Unranked
210,Cluster-Based Database Selection Techniques for Routing Bibliographic Queries.,1999,"Jian Xu, Ee-Peng Lim, Wee Keong Ng",DEXA 1999: 100-109,DEXA,C
211,On the Feasibility of Website Refresh Queries.,1999,"Haifeng Liu, Wee Keong Ng, Ee-Peng Lim",DEXA 1999: 1076-1085,DEXA,C
212,"Calling All Agents, Where Are You?",1999,"Kok-Leong Ong, Christopher Chew, Wee Keong Ng, Ee-Peng Lim",DEXA Workshop 1999: 635-639,DEXAW,Unranked
213,Locating Web Information Using Web Checkpoints.,1999,"A.-K. Luah, Wee Keong Ng, Ee-Peng Lim, W.-P. Lee, Yinyan Cao",DEXA Workshop 1999: 716-720,DEXAW,Unranked
214,WEDAGEN - A Synthetic Web Database Generator.,1999,"Pallavi Priyadarshini, Fengqiong Qin, Ee-Peng Lim, Wee Keong Ng",DEXA Workshop 1999: 744-748,DEXAW,Unranked
215,Non-Repudiation in an Agent-Based Electronic Commerce System.,1999,"C.-C. Liew, Wee Keong Ng, Ee-Peng Lim, B.-S. Tan, Kok-Leong Ong",DEXA Workshop 1999: 864-868,DEXAW,Unranked
216,Algebraic Operations on Bags in a Web Warehouse.,1999,"Sourav S. Bhowmick, Sanjay Kumar Madria, Wee Keong Ng, Ee-Peng Lim",ICSC 1999: 63-72,ICSC,Unranked
217,Cost-Benefit Analysis of Web Bag in a Web Warehouse.,1999,"Sourav S. Bhowmick, Sanjay Madria, Wee Keong Ng, Ee-Peng Lim",IDEAS 1999: 34-42,IDEAS,C
218,ZBroker: A Query Routing Broker for Z39.50 Databases.,1999,"Yong Lin, Jian Xu, Ee-Peng Lim, Wee Keong Ng",CoRR cs.DL/9902018 ,CORR,Unranked
219,Web Warehousing: An Algebra for Web Information.,1998,"Wee Keong Ng, Ee-Peng Lim, C.-T. Huang, Sourav S. Bhowmick, Fengqiong Qin",ADL 1998: 228-237,ADL,Unranked
220,Join Processing in Web Databases.,1998,"Sourav S. Bhowmick, Wee Keong Ng, Ee-Peng Lim, Sanjay Kumar Madria",DEXA 1998: 647-657,DEXA,C
221,Database Selection Techniques for Routing Bibliographic Queries.,1998,"Jian Xu, Yinyan Cao, Ee-Peng Lim, Wee Keong Ng",ACM DL 1998: 264-273,DL,Unranked
222,Querying Structured Web Resources.,1998,"Ee-Peng Lim, Cheng-Hai Tan, Boon-Wan Lim, Wee Keong Ng",ACM DL 1998: 297-298,DL,Unranked
223,Data Visualization in a Web Warehouse.,1998,"Sourav S. Bhowmick, Sanjay Kumar Madria, Wee Keong Ng, Ee-Peng Lim",ER Workshops 1998: 68-80,ER,A
224,Information Coupling in Web Databases.,1998,"Sourav S. Bhowmick, Wee Keong Ng, Ee-Peng Lim",ER 1998: 92-106,ER,A
225,Web Warehousing: Design and Issues.,1998,"Sourav S. Bhowmick, Sanjay Kumar Madria, Wee Keong Ng, Ee-Peng Lim",ER Workshops 1998: 93-104,ER,A
226,Web Bags - Are They Useful in A Web Warehouse?,1998,"Sourav S. Bhowmick, Sanjay Kumar Madria, Wee Keong Ng, Ee-Peng Lim",FODO 1998: 210-220,FODO,Unranked
227,Block-Oriented Compression Techniques for Large Statistical Databases.,1997,"Wee Keong Ng, Chinya V. Ravishankar",IEEE Trans. Knowl. Data Eng. 9: 314-328 ,TKDE,Unranked
228,A Relational Interface for Heterogeneous Information Sources.,1997,"Ee-Peng Lim, Wee Keong Ng",ADL 1997: 128-139,ADL,Unranked
229,Compression and recycling for statistical databases.,1996,Wee Keong Ng,"University of Michigan, USA, 1996",NAN,Unranked
230,Vector Quantizer Design Using Genetic Algorithms.,1996,"Sunghyun Choi, Wee Keong Ng",Data Compression Conference 1996: 430,DCC,B
231,Information Synthesis in Statistical Databases.,1995,"Wee Keong Ng, Chinya V. Ravishankar",CIKM 1995: 355-361,CIKM,A
232,Coterie Templates: A New Quorum Construction Method.,1995,"Wee Keong Ng, Chinya V. Ravishankar",ICDCS 1995: 92-99,ICDCS,A
233,Relational Database Compression Using Augmented Vector Quantization.,1995,"Wee Keong Ng, Chinya V. Ravishankar",ICDE 1995: 540-549,ICDE,A*
234,A Preliminary Study of Genetic Data Compression.,1995,"Wee Keong Ng, Chinya V. Ravishankar",ICGA 1995: 566-573,ICGA,Unranked
235,A Tuple Model for Summary Data Management .,1994,"Wee Keong Ng, Chinya V. Ravishankar",COMAD 1994,COMAD,National
236,On-Line Detection and Resolution of Communication Deadlocks.,1994,"Wee Keong Ng, Chinya V. Ravishankar",HICSS  1994: 524-533,HICSS,Unranked
237,A Physical Storage for Efficient Statistical Query Processing.,1994,"Wee Keong Ng, Chinya V. Ravishankar",SSDBM 1994: 97-106,SSDBM,B
