,Title,Year,Authors,Journal,Journal Acronym,Rank
0,Beaver Triple Generator from Multiplicatively Homomorphic Key Management Protocol.,2022,"Huafei Zhu, Wee Keong Ng",AINA  2022: 492-503,AINA,B
1,Highly Scalable Beaver Triple Generator from Additively Homomorphic Encryption.,2022,"Huafei Zhu, Wee Keong Ng",AINA  2022: 504-514,AINA,B
2,"Kaputa - Blockchain, Non-Fungible Token and Model Card Integrated 5G/6G Network Slice Broker and Marketplace.",2022,"Eranga Bandara, Sachin Shetty, Ravi Mukkamala, Abdul Rahman, Peter Foytik, Xueping Liang, Wee Keong Ng",MILCOM 2022: 559-564,MILCOM,Unranked
3,Skunk - A Blockchain and Zero Trust Security Enabled Federated Learning Platform for 5G/6G Network Slicing.,2022,"Eranga Bandara, Xueping Liang, Sachin Shetty, Ravi Mukkamala, Abdul Rahman, Wee Keong Ng",SECON 2022: 109-117,SECON,B
4,Comprehensive Performance Analysis of Homomorphic Cryptosystems for Practical Data Processing.,2022,"Vasily Sidorov, Ethan Yi Fan Wei, Wee Keong Ng",CoRR abs/2202.02960 ,CORR,Unranked
5,Promize - Blockchain and Self Sovereign Identity Empowered Mobile ATM Platform.,2021,"Eranga Bandara, Xueping Liang, Peter Foytik, Sachin Shetty, Nalin Ranasinghe, Kasun De Zoysa, Wee Keong Ng",SAI  2021: 891-911,SAI,Unranked
6,Protecting Big Data Privacy Using Randomized Tensor Network Decomposition and Dispersed Tensor Computation.,2021,"Jenn-Bing Ong, Wee Keong Ng, Ivan Tjuawinata, Chao Li, Jielin Yang, Sai None Myne, Huaxiong Wang, Kwok-Yan Lam, C.-C. Jay Kuo",CoRR abs/2101.04194 ,CORR,Unranked
7,Context-Aware Sliding Window for Sentiment Classification.,2020,"Muhammad Ali Masood, Rabeeh Ayaz Abbasi, Wee Keong Ng",IEEE Access 8: 4870-4884 ,ACCESS,Unranked
8,Privacy-Preserving Weighted Federated Learning Within the Secret Sharing Framework.,2020,"Huafei Zhu, Rick Siow Mong Goh, Wee Keong Ng",IEEE Access 8: 198275-198284 ,ACCESS,Unranked
9,Lekana - Blockchain Based Archive Storage for Large-Scale Cloud Systems.,2020,"Eranga Bandara, Xueping Liang, Sachin Shetty, Wee Keong Ng, Peter Foytik, Nalin Ranasinghe, Kasun De Zoysa, Bård Langöy, David Larsson",ICBC 2020: 169-184,ICBC,C
10,Connect - Blockchain and Self-Sovereign Identity Empowered Contact Tracing Platform.,2020,"Eranga Bandara, Xueping Liang, Peter Foytik, Sachin Shetty, Crissie Hall, Daniel Bowden, Nalin Ranasinghe, Kasun De Zoysa, Wee Keong Ng",MobiHealth 2020: 208-223,MOBIHEALTH,Unranked
11,SaaS - Microservices-Based Scalable Smart Contract Architecture.,2020,"Eranga Bandara, Xueping Liang, Peter Foytik, Sachin Shetty, Nalin Ranasinghe, Kasun De Zoysa, Wee Keong Ng",SSCC 2020: 228-243,SSCC,Unranked
12,"Scalable, On-Demand Secure Multiparty Computation for Privacy-Aware Blockchains.",2019,"Shantanu Sharma, Wee Keong Ng",BlockSys 2019: 196-211,BLOCKSYS,Unranked
13,Aplos: Smart Contracts Made Smart.,2019,"Eranga Bandara, Wee Keong Ng, Nalin Ranasinghe, Kasun De Zoysa",BlockSys 2019: 431-445,BLOCKSYS,Unranked
14,Transitive Pseudonyms Mediated EHRs Sharing for Very Important Patients.,2019,"Huafei Zhu, Wee Keong Ng",ICWS 2019: 80-94,ICWS2,Unranked
15,Learning under concept drift with follow the regularized leader and adaptive decaying proximal.,2018,"Huynh Ngoc Anh, Wee Keong Ng, Kanishka Ariyapala",Expert Syst. Appl. 96: 49-63 ,ESWA,Unranked
16,Mystiko - Blockchain Meets Big Data.,2018,"Eranga Bandara, Wee Keong Ng, Kasun De Zoysa, Newton Fernando, Supun Tharaka, P. Maurakirinathan, Namal Jayasuriya",IEEE BigData 2018: 3024-3032,BIGDATACONF,Unranked
17,A Practical Expert System with (Near) Real-Time Analysis of Large Spatial Sets of Air Traffic Data.,2018,"Vasily Sidorov, Wee Keong Ng, Mohamed Faisal Bin Mohamed Salleh",IEEE BigData 2018: 3478-3484,BIGDATACONF,Unranked
18,Audio Fingerprint Application for the Media Industry.,2018,"Andrew Putra Kusuma, Vajisha U. Wanniarachchi, Owen Noel Newton Fernando, Wee Keong Ng",UbiComp/ISWC Adjunct 2018: 114-117,HUC,Unranked
19,Sustainable Data Management Strategies and Systems in Untrust Cloud Environments.,2018,"Huafei Zhu, Wee Keong Ng",ICIT 2018: 163-167,ICIT,Unranked
20,A Collision-Free Path Planning Algorithm for Unmanned Aerial Vehicle Delivery.,2018,"Ziji Shi, Wee Keong Ng",CoRR abs/1805.03358 ,CORR,Unranked
21,Convolutional Neural Networks with Transformed Input based on Robust Tensor Network Decomposition.,2018,"Jenn-Bing Ong, Wee Keong Ng, C.-C. Jay Kuo",CoRR abs/1812.02622 ,CORR,Unranked
22,Hybrid Subspace Mixture Models for Prediction and Anomaly Detection in High Dimensions.,2017,"Jenn-Bing Ong, Wee Keong Ng",ADMA 2017: 326-339,ADMA,C
23,A New Adaptive Learning Algorithm and Its Application to Online Malware Detection.,2017,"Huynh Ngoc Anh, Wee Keong Ng, Kanishka Ariyapala",DS 2017: 18-32,DIS,A
24,Blockchain-Based System for Secure Data Storage with Private Keyword Search.,2017,"Hoang Giang Do, Wee Keong Ng",SERVICES 2017: 90-93,SERVICES,B
25,Studying Personality through the Content of Posted and Liked Images on Twitter.,2017,"Sharath Chandra Guntuku, Weisi Lin, Jordan Carpenter, Wee Keong Ng, Lyle H. Ungar, Daniel Preotiuc-Pietro",WebSci 2017: 223-227,WEBSCI,Unranked
26,A Host and Network Based Intrusion Detection for Android Smartphones.,2016,"Kanishka Ariyapala, Hoang Giang Do, Huynh Ngoc Anh, Wee Keong Ng, Mauro Conti",AINA Workshops 2016: 849-854,AINA,B
27,Privacy-Preserving Triangle Counting in Distributed Graphs.,2016,"Hoang Giang Do, Wee Keong Ng",AINA 2016: 917-924,AINA,B
28,A Method to Price Your Information Asset in the Information Market.,2016,"Divya Rao, Wee Keong Ng",BigData Congress 2016: 307-314,BIGDATA,Unranked
29,Monetizing the User's Information Asset in Internet Information Market.,2016,"Divya Rao, Wee Keong Ng",BigData Congress 2016: 337-340,BIGDATA,Unranked
30,Towards Performance Evaluation of Oblivious Data Processing Emulated with Partially Homomorphic Encryption Schemes.,2016,"Vasily Sidorov, Wee Keong Ng",BigDataSecurity/HPSC/IDS 2016: 113-115,BIGDATASEC,Unranked
31,A User-Centric Approach to Pricing Information.,2016,"Divya Rao, Wee Keong Ng",BigDataService 2016: 202-209,BIGDATASERVICE,Unranked
32,A Confidentiality-Preserving Search Technique for Encrypted Relational Cloud Databases.,2016,"Vasily Sidorov, Wee Keong Ng",BigDataService 2016: 244-251,BIGDATASERVICE,Unranked
33,Information Pricing: A Utility Based Pricing Mechanism.,2016,"Divya Rao, Wee Keong Ng",DASC/PiCom/DataCom/CyberSciTech 2016: 754-760,DASC,C
34,Application of Stylometry to DarkWeb Forum User Identification.,2016,"Thanh Nghia Ho, Wee Keong Ng",ICICS 2016: 173-183,ICICS,C
35,Private Boolean Query Processing on Encrypted Data.,2016,"Hoang Giang Do, Wee Keong Ng",ICICS 2016: 321-332,ICICS,C
36,"On periodic behavior of malware: experiments, opportunities and challenges.",2016,"Huynh Ngoc Anh, Wee Keong Ng, Hoang Giang Do",MALWARE 2016: 85-92,MALWARE,Unranked
37,Incremental Privacy-Preserving Association Rule Mining Using Negative Border.,2016,"Duc H. Tran, Wee Keong Ng, Y. D. Wong, Vinh V. Thai",PAISI 2016: 87-100,PAISI,Unranked
38,Multidimensional range query on outsourced database with strong privacy guarantee.,2016,"Hoang Giang Do, Wee Keong Ng",PST 2016: 555-560,PST,C
39,Personalizing User Interfaces for improving quality of experience in VoD recommender systems.,2016,"Sharath Chandra Guntuku, Sujoy Roy, Weisi Lin, Kelvin Ng, Wee Keong Ng, Vinit Jakhetiya",QoMEX 2016: 1-6,QOMEX,Unranked
40,Information Pricing - A User-Data Centric Method to Price Information.,2016,"Divya Rao, Wee Keong Ng",SERVICES 2016: 146-149,SERVICES,B
41,Uncovering periodic network signals of cyber attacks.,2016,"Huynh Ngoc Anh, Wee Keong Ng, Alex Ulmer, Jörn Kohlhammer",VizSEC 2016: 1-8,VIZSEC,Unranked
42,A survey on data stream clustering and classification.,2015,"Hai-Long Nguyen, Yew-Kwong Woon, Wee Keong Ng",Knowl. Inf. Syst. 45: 535-569 ,KAIS,Unranked
43,Encrypted SVM for Outsourced Data Mining.,2015,"Fang Liu, Wee Keong Ng, Wei Zhang",CLOUD 2015: 1085-1092,IEEECLOUD,Unranked
44,Encrypted Gradient Descent Protocol for Outsourced Data Mining.,2015,"Fang Liu, Wee Keong Ng, Wei Zhang",AINA 2015: 339-346,AINA,B
45,Encrypted Association Rule Mining for Outsourced Data Mining.,2015,"Fang Liu, Wee Keong Ng, Wei Zhang",AINA 2015: 550-557,AINA,B
46,How much is your information worth - A method for revenue generation for your information.,2015,"Divya Rao, Wee Keong Ng",IEEE BigData 2015: 2320-2326,BIGDATACONF,Unranked
47,How to make money from your information and keep your privacy.,2015,"Divya Rao, Wee Keong Ng",IEEE BigData 2015: 2859-2861,BIGDATACONF,Unranked
48,Secure Scalar Product for Big-Data in MapReduce.,2015,"Fang Liu, Wee Keong Ng, Wei Zhang",BigDataService 2015: 120-129,BIGDATASERVICE,Unranked
49,Privacy-preserving approach for sharing and processing intrusion alert data.,2015,"Hoang Giang Do, Wee Keong Ng",ISSNIP 2015: 1-6,ISSNIP,Unranked
50,Transparent Data Encryption for Data-in-Use and Data-at-Rest in a Cloud-Based Database-as-a-Service Solution.,2015,"Vasily Sidorov, Wee Keong Ng",SERVICES 2015: 221-228,SERVICES,B
51,A novelty detection machine and its application to bank failure prediction.,2014,"Shukai Li, Whye Loon Tung, Wee Keong Ng",Neurocomputing 130: 63-72 ,IJON,Unranked
52,Closed motifs for streaming time series classification.,2014,"Hai-Long Nguyen, Wee Keong Ng, Yew-Kwong Woon",Knowl. Inf. Syst. 41: 101-125 ,KAIS,Unranked
53,Encrypted Scalar Product Protocol for Outsourced Data Mining.,2014,"Fang Liu, Wee Keong Ng, Wei Zhang",IEEE CLOUD 2014: 336-343,IEEECLOUD,Unranked
54,Model of an Encrypted Cloud Relational Database Supporting Complex Predicates in WHERE Clause.,2014,"Vasily Sidorov, Wee Keong Ng",IEEE CLOUD 2014: 667-672,IEEECLOUD,Unranked
55,Function Level Control Flow Obfuscation for Software Security.,2014,"Vivek Balachandran, Wee Keong Ng, Sabu Emmanuel",CISIS 2014: 133-140,CISIS,C
56,Function Level Control Flow Obfuscation for Software Security.,2014,"Vivek Balachandran, Wee Keong Ng, Sabu Emmanuel",CISIS 2014: 133-140,CISIS,National
57,Encrypted Set Intersection Protocol for Outsourced Datasets.,2014,"Fang Liu, Wee Keong Ng, Wei Zhang, Do Hoang Giang, Shuguo Han",IC2E 2014: 135-140,IC2E,Unranked
58,Secure reachability query on private shared graphs.,2014,"Hoang Giang Do, Wee Keong Ng",ISSNIP 2014: 1-6,ISSNIP,Unranked
59,Obfuscation by code fragmentation to evade reverse engineering.,2014,"Vivek Balachandran, Sabu Emmanuel, Wee Keong Ng",SMC 2014: 463-469,SMC,B
60,Prolonging Lifespan of Sensor Networks Using Redundant Nodes.,2013,"Wei Zha, Wee Keong Ng",Ad Hoc Sens. Wirel. Networks 19: 1-19 ,AHSWN,Unranked
61,Maximum Volume Outlier Detection and its Applications in Credit Risk Analysis.,2013,"Shukai Li, Wee Keong Ng",Int. J. Artif. Intell. Tools 22 ,IJAIT,Unranked
62,Classification in P2P networks with cascade support vector machines.,2013,"Hock Hee Ang, Vivekanand Gopalkrishnan, Steven C. H. Hoi, Wee Keong Ng",ACM Trans. Knowl. Discov. Data 7: 20:1-20:29 ,TKDD,Unranked
63,Concurrent Semi-supervised Learning with Active Learning of Data Streams.,2013,"Hai-Long Nguyen, Wee Keong Ng, Yew-Kwong Woon",Trans. Large Scale Data Knowl. Centered Syst. 8: 113-136 ,TLSDKCS,Unranked
64,Complex Queries in a Shared Multi User Relational Cloud Database.,2013,"Vasily Sidorov, Wee Keong Ng",IEEE CLOUD 2013: 903-909,IEEECLOUD,Unranked
65,Privacy-Preserving Social Network for an Untrusted Server.,2013,"Hoang Giang Do, Wee Keong Ng, Zhendong Ma",CGC 2013: 472-478,CGC,Unranked
66,Autonomic swarms for regenerative and collaborative networking.,2013,"Rui-ping Lua, Wee Keong Ng",CollaborateCom 2013: 40-49,COLCOM,Unranked
67,Hybrid solving algorithms for an extended dynamic constraint satisfaction problem based configuration system.,2012,"Lin Wang, Wee Keong Ng",Concurr. Eng. Res. Appl. 20: 223-236 ,CERA,Unranked
68,From data to knowledge to action: A taxi business intelligence system.,2012,"Chenggang Wang, Wee Keong Ng, Huaixin Chen",FUSION 2012: 1623-1628,FUSION,C
69,Robustness of Trust Models and Combinations for Handling Unfair Ratings.,2012,"Lizi Zhang, Siwei Jiang, Jie Zhang, Wee Keong Ng",IFIPTM 2012: 36-51,IFIPTM,Unranked
70,Cloud-enabled data sharing model.,2012,"Nguyen Thanh Hung, Do Hoang Giang, Wee Keong Ng, Huafei Zhu",ISI 2012: 1-6,ISI,C
71,Geographic Routing with Cross Links.,2012,"Wei Zha, Wee Keong Ng",KICSS 2012: 181-186,KICSS,Unranked
72,Heterogeneous Ensemble for Feature Drifts in Data Streams.,2012,"Hai-Long Nguyen, Yew-Kwong Woon, Wee Keong Ng, Li Wan",PAKDD  2012: 1-12,PAKDD,B
73,Private data deduplication protocols in cloud storage.,2012,"Wee Keong Ng, Yonggang Wen, Huafei Zhu",SAC 2012: 441-446,SAC,B
74,Private data deduplication protocols in cloud storage.,2012,"Wee Keong Ng, Yonggang Wen, Huafei Zhu",SAC 2012: 441-446,SAC,Multiconference
75,Privacy-preserving In-network Aggregation in Wireless Sensor Network.,2012,"Wei Zha, Wee Keong Ng",SENSORNETS 2012: 223-228,SENSORNETS,Unranked
76,Extended DCSP Approach on Product Configuration with Cost Estimation.,2011,"Lin Wang, Wee Keong Ng, Bin Song",Concurr. Eng. Res. Appl. 19: 123-138 ,CERA,Unranked
77,Structure and attribute index for approximate graph matching in large graphs.,2011,"Linhong Zhu, Wee Keong Ng, James Cheng",Inf. Syst. 36: 958-972 ,IS,Unranked
78,Towards security in sharing data on cloud-based social networks.,2011,"Duc H. Tran, Hai-Long Nguyen, Wei Zha, Wee Keong Ng",ICICS 2011: 1-5,IEEEICICS,Unranked
79,Classifying Graphs Using Theoretical Metrics: A Study of Feasibility.,2011,"Linhong Zhu, Wee Keong Ng, Shuguo Han",DASFAA Workshops 2011: 53-64,DASFAA,B
80,An Efficient Cacheable Secure Scalar Product Protocol for Privacy-Preserving Data Mining.,2011,"Duc H. Tran, Wee Keong Ng, Hoon Wei Lim, Hai-Long Nguyen",DaWaK 2011: 354-366,DAWAK,Unranked
81,Concurrent Semi-supervised Learning of Data Streams.,2011,"Hai-Long Nguyen, Wee Keong Ng, Yew-Kwong Woon, Duc H. Tran",DaWaK 2011: 445-459,DAWAK,Unranked
82,Predict Energy Consumption of Trigger-Driven Sensor Network by Markov Chains.,2011,"Wei Zha, Wee Keong Ng",ICDCS Workshops 2011: 350-356,ICDCSW,Unranked
83,IntRank: Interaction Ranking-Based Trustworthy Friend Recommendation.,2011,"Lizi Zhang, Hui Fang, Wee Keong Ng, Jie Zhang",TrustCom 2011: 266-273,TRUSTCOM,Unranked
84,The Influence of Interaction Attributes on Trust in Virtual Communities.,2011,"Lizi Zhang, Cheun Pin Tan, Siyi Li, Hui Fang, Pramodh Rai, Yao Chen, Rohit Luthra, Wee Keong Ng, Jie Zhang",UMAP Workshops 2011: 268-279,UM,Unranked
85,P2PDocTagger: Content management through automated P2P collaborative tagging.,2010,"Hock Hee Ang, Vivekanand Gopalkrishnan, Wee Keong Ng, Steven C. H. Hoi",Proc. VLDB Endow. 3: 1601-1604 ,PVLDB,Unranked
86,Incremental Maintenance of 2-Hop Labeling of Large Graphs.,2010,"Ramadhana Bramandia, Byron Choi, Wee Keong Ng",IEEE Trans. Knowl. Data Eng. 22: 682-698 ,TKDE,Unranked
87,Privacy-Preserving Gradient-Descent Methods.,2010,"Shuguo Han, Wee Keong Ng, Li Wan, Vincent C. S. Lee",IEEE Trans. Knowl. Data Eng. 22: 884-899 ,TKDE,Unranked
88,Adaptive Ensemble Classification in P2P Networks.,2010,"Hock Hee Ang, Vivekanand Gopalkrishnan, Steven C. H. Hoi, Wee Keong Ng",DASFAA  2010: 34-48,DASFAA,B
89,Satrap: Data and Network Heterogeneity Aware P2P Data-Mining.,2010,"Hock Hee Ang, Vivekanand Gopalkrishnan, Anwitaman Datta, Wee Keong Ng, Steven C. H. Hoi",PAKDD  2010: 63-70,PAKDD,B
90,On Classifying Drifting Concepts in P2P Networks.,2010,"Hock Hee Ang, Vivekanand Gopalkrishnan, Wee Keong Ng, Steven C. H. Hoi",ECML/PKDD  2010: 24-39,PKDD,Unranked
91,MICHO: a scalable constraint-based algorithm for learning Bayesian networks.,2010,"Murugan Ayyappan, Yew-Kwong Woon, Wee Keong Ng",SAC 2010: 985-989,SAC,B
92,MICHO: a scalable constraint-based algorithm for learning Bayesian networks.,2010,"Murugan Ayyappan, Yew-Kwong Woon, Wee Keong Ng",SAC 2010: 985-989,SAC,Multiconference
93,Regression models for estimating product life cycle cost.,2009,"Haifeng Liu, Vivekanand Gopalkrishnan, Thi Nhu Quynh Kim, Wee Keong Ng",J. Intell. Manuf. 20: 401-408 ,JIM,Unranked
94,Density-based clustering of data streams at multiple resolutions.,2009,"Li Wan, Wee Keong Ng, Xuan-Hong Dang, Philip S. Yu, Kuan Zhang",ACM Trans. Knowl. Discov. Data 3: 14:1-14:28 ,TKDD,Unranked
95,A Uniform Framework for Ad-Hoc Indexes to Answer Reachability Queries on Large Graphs.,2009,"Linhong Zhu, Byron Choi, Bingsheng He, Jeffrey Xu Yu, Wee Keong Ng",DASFAA 2009: 138-152,DASFAA,B
96,An EM-Based Algorithm for Clustering Data Streams in Sliding Windows.,2009,"Xuan-Hong Dang, Vincent C. S. Lee, Wee Keong Ng, Arridhana Ciptadi, Kok-Leong Ong",DASFAA 2009: 230-235,DASFAA,B
97,Incremental and Adaptive Clustering Stream Data over Sliding Window.,2009,"Xuan-Hong Dang, Vincent C. S. Lee, Wee Keong Ng, Kok-Leong Ong",DEXA 2009: 660-674,DEXA,C
98,Editorial to the Proceedings of mobile technologies in enterprise computing systems workshop (MTECS 2009).,2009,"Tiong-Thye Goh, Siddhartha Bose, Wee Keong Ng, Longbing Cao, Vincent C. S. Lee",EDOCW 2009: 138-139,EDOC,B
99,Privacy-Preserving Singular Value Decomposition.,2009,"Shuguo Han, Wee Keong Ng, Philip S. Yu",ICDE 2009: 1267-1270,ICDE,A*
100,Constraint Satisfaction Approach on Product Configuration with Cost Estimation.,2009,"Lin Wang, Wee Keong Ng, Bing Song",IEA/AIE 2009: 731-740,IEAAIE,Unranked
101,Communication-Efficient Classification in P2P Networks.,2009,"Hock Hee Ang, Vivekanand Gopalkrishnan, Wee Keong Ng, Steven C. H. Hoi",ECML/PKDD  2009: 83-98,PKDD,Unranked
102,Frequent Sets Mining in Data Stream Environments.,2009,"Xuan-Hong Dang, Wee Keong Ng, Kok-Leong Ong, Vincent C. S. Lee",Encyclopedia of Data Warehousing and Mining 2009: 901-906,DATAWARE,Unranked
103,Editorial.,2008,"Wee Keong Ng, Masaru Kitsuregawa, Jianzhong Li",Knowl. Inf. Syst. 14: 141-142 ,KAIS,Unranked
104,Online mining of frequent sets in data streams with error guarantee.,2008,"Xuan-Hong Dang, Wee Keong Ng, Kok-Leong Ong",Knowl. Inf. Syst. 16: 245-258 ,KAIS,Unranked
105,Classification in P2P Networks by Bagging Cascade RSVMs.,2008,"Hock Hee Ang, Vivekanand Gopalkrishnan, Steven C. H. Hoi, Wee Keong Ng, Anwitaman Datta",DBISP2P 2008: 13-25,DBISP2P,Unranked
106,Privacy-Preserving Linear Fisher Discriminant Analysis.,2008,"Shuguo Han, Wee Keong Ng",PAKDD 2008: 136-147,PAKDD,B
107,Cascade RSVM in Peer-to-Peer Networks.,2008,"Hock Hee Ang, Vivekanand Gopalkrishnan, Steven C. H. Hoi, Wee Keong Ng",ECML/PKDD  2008: 55-70,PKDD,Unranked
108,Preemptive Measures against Malicious Party in Privacy-Preserving Data Mining.,2008,"Shuguo Han, Wee Keong Ng",SDM 2008: 375-386,SDM,A
109,Proportionate feature selection - A pre-processing step for clustering.,2008,"Jashanjot Singh Sekhon, Vivekanand Gopalkrishnan, Wee Keong Ng",SMC 2008: 2622-2627,SMC,B
110,On incremental maintenance of 2-hop labeling of graphs.,2008,"Ramadhana Bramandia, Byron Choi, Wee Keong Ng",WWW 2008: 845-854,WWW,A*
111,Dynamical Systems for Discovering Protein Complexes and Functional Modules from Biological Networks.,2007,"Wenyuan Li, Ying Liu, Hung-Chung Huang, Yanxiong Peng, Yongjing Lin, Wee Keong Ng, Kok-Leong Ong",IEEE ACM Trans. Comput. Biol. Bioinform. 4: 233-250 ,TCBB,Unranked
112,Enhancing the Effectiveness of Clustering with Spectra Analysis.,2007,"Wenyuan Li, Wee Keong Ng, Ying Liu, Kok-Leong Ong",IEEE Trans. Knowl. Data Eng. 19: 887-902 ,TKDE,Unranked
113,Enabling Mass Customization through Semantic Web Services.,2007,"Haifeng Liu, Wee Keong Ng, Bin Song, Xiang Li, Wen-Feng Lu",APSCC 2007: 239-245,APSCC,C
114,Discovering Frequent Sets from Data Streams with CPU Constraint.,2007,"Xuan-Hong Dang, Wee Keong Ng, Kok-Leong Ong, Vincent C. S. Lee",AusDM 2007: 121-128,AUSDM,Unranked
115,Privacy-Preserving Genetic Algorithms for Rule Discovery.,2007,"Shuguo Han, Wee Keong Ng",DaWaK 2007: 407-417,DAWAK,Unranked
116,Privacy-Preserving Self-Organizing Map.,2007,"Shuguo Han, Wee Keong Ng",DaWaK 2007: 428-437,DAWAK,Unranked
117,Estimating product lifecycle cost using a hybrid approach.,2007,"Haifeng Liu, Vivekanand Gopalkrishnan, Wee Keong Ng, Bin Song, Xiang Li",ICDIM 2007: 393-398,ICDIM,Unranked
118,An Intelligent Information System for Enabling Product Mass Customization.,2007,"Haifeng Liu, Wee Keong Ng, Bin Song, Xiang Li, Wen-Feng Lu",ICEIS  2007: 316-321,ICEIS,Unranked
119,Privacy-preservation for gradient descent methods.,2007,"Li Wan, Wee Keong Ng, Shuguo Han, Vincent C. S. Lee",KDD 2007: 775-783,KDD,A*
120,EStream: Online Mining of Frequent Sets with Precise Error Guarantee.,2006,"Xuan-Hong Dang, Wee Keong Ng, Kok-Leong Ong",DaWaK 2006: 312-321,DAWAK,Unranked
121,Adaptive Load Shedding for Mining Frequent Patterns from Data Streams.,2006,"Xuan-Hong Dang, Wee Keong Ng, Kok-Leong Ong",DaWaK 2006: 342-351,DAWAK,Unranked
122,"Advances in Knowledge Discovery and Data Mining, 10th Pacific-Asia Conference, PAKDD 2006, Singapore, April 9-12, 2006, Proceedings.",2006,"Wee Keong Ng, Masaru Kitsuregawa, Jianzhong Li, Kuiyu Chang","Lecture Notes in Computer Science 3918, Springer 2006, ISBN 3-540-33206-5 ",PAKDD,B
123,Agents and Stream Data Mining: A New Perspective.,2005,"Kok-Leong Ong, Zili Zhang, Wee Keong Ng, Ee-Peng Lim",IEEE Intell. Syst. 20: 60-67 ,EXPERT,Unranked
124,On organizing and accessing geospatial and georeferenced Web resources using the G-Portal system.,2005,"Ee-Peng Lim, Zehua Liu, Ming Yin, Dion Hoe-Lian Goh, Yin Leng Theng, Wee Keong Ng",Inf. Process. Manag. 41: 1277-1297 ,IPM,Unranked
125,Web data extraction based on structural similarity.,2005,"Zhao Li, Wee Keong Ng, Aixin Sun",Knowl. Inf. Syst. 8: 438-461 ,KAIS,Unranked
126,Scheduling Queries to Improve the Freshness of a Website.,2005,"Haifeng Liu, Wee Keong Ng, Ee-Peng Lim",World Wide Web 8: 61-90 ,WWW,A*
127,WDEE: Web Data Extraction by Example.,2005,"Zhao Li, Wee Keong Ng",DASFAA 2005: 347-358,DASFAA,B
128,Spectral Kernels for Classification.,2005,"Wenyuan Li, Kok-Leong Ong, Wee Keong Ng, Aixin Sun",DaWaK 2005: 520-529,DAWAK,Unranked
129,Visual Terrain Analysis of High-Dimensional Datasets.,2005,"Wenyuan Li, Kok-Leong Ong, Wee Keong Ng",PKDD 2005: 593-600,PKDD,Unranked
130,Web Data Management: A Warehouse Approach.,2004,"Sourav S. Bhowmick, Wee Keong Ng, Sanjay Kumar Madria","Springer 2004, ISBN 978-0-387-00175-3",SANJAYKUMARMADRIA.HTML,Unranked
131,Towards building logical views of websites.,2004,"Zehua Liu, Wee Keong Ng, Ee-Peng Lim, Feifei Li",Data Knowl. Eng. 49: 197-222 ,DKE,Unranked
132,Personalized Web Views for Multilingual Web Sources.,2004,"Zehua Liu, Wee Keong Ng, Ee-Peng Lim",IEEE Internet Comput. 8: 16-22 ,INTERNET,Unranked
133,Parameter driven synthetic web database generation.,2004,"Pallavi Priyadarshini, Fengqiong Qin, Ee-Peng Lim, Wee Keong Ng",J. Syst. Softw. 69: 29-42 ,JSS,Unranked
134,A Java-based digital library portal for geography education.,2004,"Zehua Liu, Hai Yu, Ee-Peng Lim, Ming Yin, Dion Hoe-Lian Goh, Yin Leng Theng, Wee Keong Ng",Sci. Comput. Program. 53: 87-105 ,SCP,Unranked
135,A Support-Ordered Trie for Fast Frequent Itemset Discovery.,2004,"Yew Kwong Woon, Wee Keong Ng, Ee-Peng Lim",IEEE Trans. Knowl. Data Eng. 16: 875-879 ,TKDE,Unranked
136,Blocking Reduction Strategies in Hierarchical Text Classification.,2004,"Aixin Sun, Ee-Peng Lim, Wee Keong Ng, Jaideep Srivastava",IEEE Trans. Knowl. Data Eng. 16: 1305-1308 ,TKDE,Unranked
137,Unloading Unwanted Information: From Physical Websites to Personalized Web Views.,2004,"Zehua Liu, Wee Keong Ng, Ee-Peng Lim",APWeb 2004: 111-121,APWEB,C
138,An Automated Algorithm for Extracting Website Skeleton.,2004,"Zehua Liu, Wee Keong Ng, Ee-Peng Lim",DASFAA 2004: 799-811,DASFAA,B
139,SCLOPE: An Algorithm for Clustering Data Streams of Categorical Attributes.,2004,"Kok-Leong Ong, Wenyuan Li, Wee Keong Ng, Ee-Peng Lim",DaWaK 2004: 209-218,DAWAK,Unranked
140,OWDEAH: Online Web Data Extraction Based on Access History.,2004,"Zhao Li, Wee Keong Ng, Kok-Leong Ong",DaWaK 2004: 269-278,DAWAK,Unranked
141,WICCAP: From Semi-structured Data to Structured Data.,2004,"Zhao Li, Wee Keong Ng",ECBS 2004: 86-93,ECBS,Unranked
142,Spectral Analysis of Text Collection for Similarity-based Clustering.,2004,"Wenyuan Li, Wee Keong Ng, Ee-Peng Lim",ICDE 2004: 833,ICDE,A*
143,Spectral Analysis of Text Collection for Similarity-Based Clustering.,2004,"Wenyuan Li, Wee Keong Ng, Ee-Peng Lim",PAKDD 2004: 389-393,PAKDD,B
144,A Spectroscopy of Texts for Effective Clustering.,2004,"Wenyuan Li, Wee Keong Ng, Kok-Leong Ong, Ee-Peng Lim",PKDD 2004: 301-312,PKDD,Unranked
145,Representation of Web Data in A Web Warehouse.,2003,"Sourav S. Bhowmick, Sanjay Madria, Wee Keong Ng",Comput. J. 46: 229-262 ,CJ,Unranked
146,Constraint-driven join processing in a Web Warehouse.,2003,"Sourav S. Bhowmick, Wee Keong Ng, Sanjay Kumar Madria",Data Knowl. Eng. 45: 33-78 ,DKE,Unranked
147,Deriving and verifying statistical distribution of a hyperlink-based Web page quality metric.,2003,"Devanshu Dhyani, Sourav S. Bhowmick, Wee Keong Ng",Data Knowl. Eng. 46: 291-315 ,DKE,Unranked
148,Data model for warehousing historical Web information.,2003,"Yinyan Cao, Ee-Peng Lim, Wee Keong Ng",Inf. Softw. Technol. 45: 315-334 ,INFSOF,Unranked
149,Performance measurement framework for hierarchical text classification.,2003,"Aixin Sun, Ee-Peng Lim, Wee Keong Ng",J. Assoc. Inf. Sci. Technol. 54: 1014-1028 ,JASIS,Unranked
150,Detecting and Representing Relevant Web Deltas in WHOWEDA.,2003,"Sourav S. Bhowmick, Sanjay Kumar Madria, Wee Keong Ng",IEEE Trans. Knowl. Data Eng. 15: 423-441 ,TKDE,Unranked
151,CrystalBall : A Framework for Mining Variants of Association Rules.,2003,"Kok-Leong Ong, Wee Keong Ng, Ee-Peng Lim",ADC 2003: 85-94,ADC,Australasian B
152,ENAXS: Efficient Native XML Storage System.,2003,"Khin-Myo Win, Wee Keong Ng, Ee-Peng Lim",APWeb 2003: 59-70,APWEB,C
153,Efficient Web Log Mining for Product Development.,2003,"Yew Kwong Woon, Wee Keong Ng, Xiang Li, Wen-Feng Lu",CW 2003: 294-301,CW,C
154,An Architectural Framework for Native XML Data Management.,2003,"Khin-Myo Win, Wee Keong Ng, Ee-Peng Lim",CW 2003: 302-309,CW,C
