,Title,Year,Authors,Journal,Journal Acronym,Rank
0,Teacher-apprentices RL (TARL): leveraging complex policy distribution through generative adversarial hypernetwork in reinforcement learning.,2023,"Shi Yuan Tang, Athirai A. Irissappane, Frans A. Oliehoek, Jie Zhang",Auton. Agents Multi Agent Syst. 37: 25 ,AAMAS,A*
1,DaisyRec 2.0: Benchmarking Recommendation for Rigorous Evaluation.,2023,"Zhu Sun, Hui Fang, Jie Yang, Xinghua Qu, Hongyang Liu, Di Yu, Yew-Soon Ong, Jie Zhang",IEEE Trans. Pattern Anal. Mach. Intell. 45: 8206-8226 ,PAMI,Unranked
2,Learning to Solve 3-D Bin Packing Problem via Deep Reinforcement Learning and Constraint Programming.,2023,"Yuan Jiang, Zhiguang Cao, Jie Zhang",IEEE Trans. Cybern. 53: 2864-2875 ,TCYB,Unranked
3,A Deep Reinforcement Learning Recommender System With Multiple Policies for Recommendations.,2023,"Mingsheng Fu, Liwei Huang, Ananya Rao, Athirai A. Irissappane, Jie Zhang, Hong Qu",IEEE Trans. Ind. Informatics 19: 2049-2061 ,TII,Unranked
4,Learning to Solve Multiple-TSP With Time Window and Rejections via Deep Reinforcement Learning.,2023,"Rongkai Zhang, Cong Zhang, Zhiguang Cao, Wen Song, Puay Siew Tan, Jie Zhang, Bihan Wen, Justin Dauwels",IEEE Trans. Intell. Transp. Syst. 24: 1325-1336 ,TITS,Unranked
5,Dynamic Opinion Maximization in Social Networks.,2023,"Qiang He, Hui Fang, Jie Zhang, Xingwei Wang",IEEE Trans. Knowl. Data Eng. 35: 350-361 ,TKDE,Unranked
6,Learning Large Neighborhood Search for Vehicle Routing in Airport Ground Handling.,2023,"Jianan Zhou, Yaoxin Wu, Zhiguang Cao, Wen Song, Jie Zhang, Zhenghua Chen",IEEE Trans. Knowl. Data Eng. 35: 9769-9782 ,TKDE,Unranked
7,A Critical Study on Data Leakage in Recommender System Offline Evaluation.,2023,"Yitong Ji, Aixin Sun, Jie Zhang, Chenliang Li",ACM Trans. Inf. Syst. 41: 75:1-75:27 ,TOIS,Unranked
8,A Semi-Centralized Trust Management Model Based on Blockchain for Data Exchange in IoT System.,2023,"Yuan Liu, Chuang Zhang, Yu Yan, Xin Zhou, Zhihong Tian, Jie Zhang",IEEE Trans. Serv. Comput. 16: 858-871 ,TSC,Unranked
9,Reinforcement Learning Enhanced Weighted Sampling for Accurate Subgraph Counting on Fully Dynamic Graph Streams.,2023,"Kaixin Wang, Cheng Long, Da Yan, Jie Zhang, H. V. Jagadish",ICDE 2023: 1084-1097,ICDE,A*
10,Disentangling Motives behind Item Consumption and Social Connection for Mutually-enhanced Joint Prediction.,2023,"Youchen Sun, Zhu Sun, Xiao Sha, Jie Zhang, Yew Soon Ong",RecSys 2023: 613-624,RECSYS,Unranked
11,Multi-view graph contrastive learning for solving vehicle routing problems.,2023,"Yuan Jiang, Zhiguang Cao, Yaoxin Wu, Jie Zhang",UAI 2023: 984-994,UAI,A
12,WSDM 2023 Workshop on Interactive Recommender Systems.,2023,"Yong Liu, Hao Zhang, Zhu Sun, Shoujin Wang, Jie Zhang",WSDM 2023: 1275-1276,WSDM,A
13,"Proceedings of the 17th ACM Conference on Recommender Systems, RecSys 2023, Singapore, Singapore, September 18-22, 2023.",2023,"Jie Zhang, Li Chen, Shlomo Berkovsky, Min Zhang, Tommaso Di Noia, Justin Basilico, Luiz Pizzato, Yang Song",ACM 2023 ,RECSYS,Unranked
14,Learning Large Neighborhood Search for Vehicle Routing in Airport Ground Handling.,2023,"Jianan Zhou, Yaoxin Wu, Zhiguang Cao, Wen Song, Jie Zhang, Zhenghua Chen",CoRR abs/2302.13797 ,CORR,Unranked
15,Neural Airport Ground Handling.,2023,"Yaoxin Wu, Jianan Zhou, Yunwen Xia, Xianli Zhang, Zhiguang Cao, Jie Zhang",CoRR abs/2303.02442 ,CORR,Unranked
16,Retraining A Graph-based Recommender with Interests Disentanglement.,2023,"Yitong Ji, Aixin Sun, Jie Zhang",CoRR abs/2305.03624 ,CORR,Unranked
17,Towards Omni-generalizable Neural Methods for Vehicle Routing Problems.,2023,"Jianan Zhou, Yaoxin Wu, Wen Song, Zhiguang Cao, Jie Zhang",CoRR abs/2305.19587 ,CORR,Unranked
18,Our Model Achieves Excellent Performance on MovieLens: What Does it Mean?,2023,"Yu-chen Fan, Yitong Ji, Jie Zhang, Aixin Sun",CoRR abs/2307.09985 ,CORR,Unranked
19,Integrating social influence modeling and user modeling for trust prediction in signed networks.,2022,"Hui Fang, Xiaoming Li, Jie Zhang",Artif. Intell. 302: 103628 ,AI,Australasian B
20,A sub-action aided deep reinforcement learning framework for latency-sensitive network slicing.,2022,"Da Xiao, Shuo Chen, Wei Ni, Jie Zhang, Jian (Andrew) Zhang, Ren Ping Liu",Comput. Networks 217: 109279 ,CN,National
21,Learning variable ordering heuristics for solving Constraint Satisfaction Problems.,2022,"Wen Song, Zhiguang Cao, Jie Zhang, Chi Xu, Andrew Lim",Eng. Appl. Artif. Intell. 109: 104603 ,EAAI,Unranked
22,ACDC: Online unsupervised cross-domain adaptation.,2022,"Marcus de Carvalho, Mahardhika Pratama, Jie Zhang, Edward Kien Yee Yapp",Knowl. Based Syst. 253: 109486 ,KBS,Unranked
23,Disentangling Multi-Facet Social Relations for Recommendation.,2022,"Xiao Sha, Zhu Sun, Jie Zhang",IEEE Trans. Comput. Soc. Syst. 9: 867-878 ,TCSS,Unranked
24,TriATNE: Tripartite Adversarial Training for Network Embeddings.,2022,"Qi-dong Liu, Cheng Long, Jie Zhang, Mingliang Xu, Pei Lv",IEEE Trans. Cybern. 52: 9634-9645 ,TCYB,Unranked
25,Deep Reinforcement Learning Framework for Category-Based Item Recommendation.,2022,"Mingsheng Fu, Anubha Agrawal, Athirai A. Irissappane, Jie Zhang, Liwei Huang, Hong Qu",IEEE Trans. Cybern. 52: 12028-12041 ,TCYB,Unranked
26,Deep Reinforcement Learning for Solving the Heterogeneous Capacitated Vehicle Routing Problem.,2022,"Jingwen Li, Yining Ma, Ruize Gao, Zhiguang Cao, Andrew Lim, Wen Song, Jie Zhang",IEEE Trans. Cybern. 52: 13572-13585 ,TCYB,Unranked
27,Heterogeneous Attentions for Solving Pickup and Delivery Problem via Deep Reinforcement Learning.,2022,"Jingwen Li, Liang Xin, Zhiguang Cao, Andrew Lim, Wen Song, Jie Zhang",IEEE Trans. Intell. Transp. Syst. 23: 2306-2315 ,TITS,Unranked
28,GP3: Gaussian Process Path Planning for Reliable Shortest Path in Transportation Networks.,2022,"Hongliang Guo, Xuejie Hou, Zhiguang Cao, Jie Zhang",IEEE Trans. Intell. Transp. Syst. 23: 11575-11590 ,TITS,Unranked
29,Point-of-Interest Recommendation for Users-Businesses With Uncertain Check-ins.,2022,"Zhu Sun, Chen Li, Yu Lei, Lu Zhang, Jie Zhang, Shunpan Liang",IEEE Trans. Knowl. Data Eng. 34: 5925-5938 ,TKDE,Unranked
30,Learning Improvement Heuristics for Solving Routing Problems.,2022,"Yaoxin Wu, Wen Song, Zhiguang Cao, Jie Zhang, Andrew Lim",IEEE Trans. Neural Networks Learn. Syst. 33: 5057-5069 ,TNN,Unranked
31,VRepChain: A Decentralized and Privacy-Preserving Reputation System for Social Internet of Vehicles Based on Blockchain.,2022,"Yuan Liu, Zehui Xiong, Qin Hu, Dusit Niyato, Jie Zhang, Chunyan Miao, Cyril Leung, Zhihong Tian",IEEE Trans. Veh. Technol. 71: 13242-13253 ,TVT,Unranked
32,Learning to Solve Routing Problems via Distributionally Robust Optimization.,2022,"Yuan Jiang, Yaoxin Wu, Zhiguang Cao, Jie Zhang",AAAI 2022: 9786-9794,AAAI,A*
33,Learning Scenario Representation for Solving Two-stage Stochastic Integer Programs.,2022,"Yaoxin Wu, Wen Song, Zhiguang Cao, Jie Zhang",ICLR 2022,ICLR,A*
34,Do Loyal Users Enjoy Better Recommendations?: Understanding Recommender Accuracy from a Time Perspective.,2022,"Yitong Ji, Aixin Sun, Jie Zhang, Chenliang Li",ICTIR 2022: 92-97,ICTIR,Unranked
35,Next Point-of-Interest Recommendation with Inferring Multi-step Future Preferences.,2022,"Lu Zhang, Zhu Sun, Ziqing Wu, Jie Zhang, Yew Soon Ong, Xinghua Qu",IJCAI 2022: 3751-3757,IJCAI,A*
36,Graph Learning Assisted Multi-Objective Integer Programming.,2022,"Yaoxin Wu, Wen Song, Zhiguang Cao, Jie Zhang, Abhishek Gupta, Mingyan Lin",NeurIPS 2022,NIPS,Unranked
37,Class-Incremental Learning via Knowledge Amalgamation.,2022,"Marcus de Carvalho, Mahardhika Pratama, Jie Zhang, Yajuan Sun",ECML/PKDD  2022: 36-50,PKDD,Unranked
38,Prototype Feature Extraction for Multi-task Learning.,2022,"Shen Xin, Yuhang Jiao, Cheng Long, Yuguang Wang, Xiaowei Wang, Sen Yang, Ji Liu, Jie Zhang",WWW 2022: 2472-2481,WWW,A*
39,Learning to Solve Routing Problems via Distributionally Robust Optimization.,2022,"Yuan Jiang, Yaoxin Wu, Zhiguang Cao, Jie Zhang",CoRR abs/2202.07241 ,CORR,Unranked
40,Recommender May Not Favor Loyal Users.,2022,"Yitong Ji, Aixin Sun, Jie Zhang, Chenliang Li",CoRR abs/2204.05927 ,CORR,Unranked
41,DaisyRec 2.0: Benchmarking Recommendation for Rigorous Evaluation.,2022,"Zhu Sun, Hui Fang, Jie Yang, Xinghua Qu, Hongyang Liu, Di Yu, Yew-Soon Ong, Jie Zhang",CoRR abs/2206.10848 ,CORR,Unranked
42,A Multi-Channel Next POI Recommendation Framework with Multi-Granularity Check-in Signals.,2022,"Zhu Sun, Yu Lei, Lu Zhang, Chen Li, Yew-Soon Ong, Jie Zhang",CoRR abs/2209.00472 ,CORR,Unranked
43,Class-Incremental Learning via Knowledge Amalgamation.,2022,"Marcus de Carvalho, Mahardhika Pratama, Jie Zhang, Yajuan San",CoRR abs/2209.02112 ,CORR,Unranked
44,Learning to Solve Multiple-TSP with Time Window and Rejections via Deep Reinforcement Learning.,2022,"Rongkai Zhang, Cong Zhang, Zhiguang Cao, Wen Song, Puay Siew Tan, Jie Zhang, Bihan Wen, Justin Dauwels",CoRR abs/2209.06094 ,CORR,Unranked
45,Reinforcement Learning Enhanced Weighted Sampling for Accurate Subgraph Counting on Fully Dynamic Graph Streams.,2022,"Kaixin Wang, Cheng Long, Da Yan, Jie Zhang, H. V. Jagadish",CoRR abs/2211.06793 ,CORR,Unranked
46,Learning to Search for Job Shop Scheduling via Deep Reinforcement Learning.,2022,"Cong Zhang, Wen Song, Zhiguang Cao, Jie Zhang, Puay Siew Tan, Chi Xu",CoRR abs/2211.10936 ,CORR,Unranked
47,Decision-making with Imaginary Opponent Models.,2022,"Jing Sun, Shuo Chen, Cong Zhang, Jie Zhang",CoRR abs/2211.11940 ,CORR,Unranked
48,Hierarchical attentive knowledge graph embedding for personalized recommendation.,2021,"Xiao Sha, Zhu Sun, Jie Zhang",Electron. Commer. Res. Appl. 48: 101071 ,ECRA,Unranked
49,Step-Wise Deep Learning Models for Solving Routing Problems.,2021,"Liang Xin, Wen Song, Zhiguang Cao, Jie Zhang",IEEE Trans. Ind. Informatics 17: 4861-4871 ,TII,Unranked
50,Multi-Decoder Attention Model with Embedding Glimpse for Solving Vehicle Routing Problems.,2021,"Liang Xin, Wen Song, Zhiguang Cao, Jie Zhang",AAAI 2021: 12042-12049,AAAI,A*
51,Preventing Overfitting via Sample Reweighting for Recommender System Incremental Update (Student Abstract).,2021,"Danni Peng, Xiaobo Hu, Anxiang Zeng, Jie Zhang",AAAI 2021: 15863-15864,AAAI,A*
52,Learning Complex Policy Distribution with CEM Guided Adversarial Hypernetwork.,2021,"Shi Yuan Tang, Athirai A. Irissappane, Frans A. Oliehoek, Jie Zhang",AAMAS 2021: 1308-1316,ATAL,Unranked
53,Solving 3D Bin Packing Problem via Multimodal Deep Reinforcement Learning.,2021,"Yuan Jiang, Zhiguang Cao, Jie Zhang",AAMAS 2021: 1548-1550,ATAL,Unranked
54,A Blockchain-Enabled Quantitative Approach to Trust and Reputation Management with Sparse Evidence.,2021,"Leonid Zeynalvand, Tie Luo, Ewa Andrejczuk, Dusit Niyato, Sin G. Teo, Jie Zhang",AAMAS 2021: 1707-1708,ATAL,Unranked
55,ATNN: Adversarial Two-Tower Neural Network for New Item's Popularity Prediction in E-commerce.,2021,"Shen Xin, Zhao Li, Pengcheng Zou, Cheng Long, Jie Zhang, Jiajun Bu, Jingren Zhou",ICDE 2021: 2499-2510,ICDE,A*
56,NeuroLKH: Combining Deep Learning Model with Lin-Kernighan-Helsgaun Heuristic for Solving the Traveling Salesman Problem.,2021,"Liang Xin, Wen Song, Zhiguang Cao, Jie Zhang",NeurIPS 2021: 7472-7483,NIPS,Unranked
57,Learning Large Neighborhood Search Policy for Integer Programming.,2021,"Yaoxin Wu, Wen Song, Zhiguang Cao, Jie Zhang",NeurIPS 2021: 30075-30087,NIPS,Unranked
58,Learning an Adaptive Meta Model-Generator for Incrementally Updating Recommender Systems.,2021,"Danni Peng, Sinno Jialin Pan, Jie Zhang, Anxiang Zeng",RecSys 2021: 411-421,RECSYS,Unranked
59,Adaptive Holding for Online Bottleneck Matching with Delays.,2021,"Kaixin Wang, Cheng Long, Yongxin Tong, Jie Zhang, Yi Xu",SDM 2021: 235-243,SDM,A
60,Exploiting Human Trust to Improve Recommender Systems.,2021,Jie Zhang,UMAP  2021: 181,UM,Unranked
61,"Proceedings of the 22nd International Workshop on Trust in Agent Societies (TRUST 2021) Co-located with the 20th International Conferences on Autonomous Agents and Multiagent Systems (AAMAS 2021), London, UK, May 3-7, 2021.",2021,"Dongxia Wang, Rino Falcone, Jie Zhang","CEUR Workshop Proceedings 3022, CEUR-WS.org 2021 ",ATAL,Unranked
62,SelfCF: A Simple Framework for Self-supervised Collaborative Filtering.,2021,"Xin Zhou, Aixin Sun, Yong Liu, Jie Zhang, Chunyan Miao",CoRR abs/2107.03019 ,CORR,Unranked
63,ACDC: Online Unsupervised Cross-Domain Adaptation.,2021,"Marcus de Carvalho, Mahardhika Pratama, Jie Zhang, Edward Kien Yee Yapp",CoRR abs/2110.01326 ,CORR,Unranked
64,Deep Reinforcement Learning for Solving the Heterogeneous Capacitated Vehicle Routing Problem.,2021,"Jingwen Li, Yining Ma, Ruize Gao, Zhiguang Cao, Andrew Lim, Wen Song, Jie Zhang",CoRR abs/2110.02629 ,CORR,Unranked
65,Heterogeneous Attentions for Solving Pickup and Delivery Problem via Deep Reinforcement Learning.,2021,"Jingwen Li, Liang Xin, Zhiguang Cao, Andrew Lim, Wen Song, Jie Zhang",CoRR abs/2110.02634 ,CORR,Unranked
66,NeuroLKH: Combining Deep Learning Model with Lin-Kernighan-Helsgaun Heuristic for Solving the Traveling Salesman Problem.,2021,"Liang Xin, Wen Song, Zhiguang Cao, Jie Zhang",CoRR abs/2110.07983 ,CORR,Unranked
67,Learning Large Neighborhood Search Policy for Integer Programming.,2021,"Yaoxin Wu, Wen Song, Zhiguang Cao, Jie Zhang",CoRR abs/2111.03466 ,CORR,Unranked
68,Learning an Adaptive Meta Model-Generator for Incrementally Updating Recommender Systems.,2021,"Danni Peng, Sinno Jialin Pan, Jie Zhang, Anxiang Zeng",CoRR abs/2111.04282 ,CORR,Unranked
69,"A 2020 perspective on ""A generalized stereotype learning approach and its instantiation in trust modeling"".",2020,"Hui Fang, Jie Zhang, Murat Sensoy",Electron. Commer. Res. Appl. 40: 100955 ,ECRA,Unranked
70,Modeling hierarchical category transition for next POI recommendation with uncertain check-ins.,2020,"Lu Zhang, Zhu Sun, Jie Zhang, Horst Kloeden, Felix Klanner",Inf. Sci. 515: 169-190 ,ISCI,Unranked
71,Cost-sensitive deep forest for price prediction.,2020,"Chao Ma, Zhenbing Liu, Zhiguang Cao, Wen Song, Jie Zhang, Weiliang Zeng",Pattern Recognit. 107: 107499 ,PR,Unranked
72,Learning Network Representations With Different Order Structural Information.,2020,"Qi-dong Liu, Xin Zhou, Cheng Long, Jie Zhang, Mingliang Xu",IEEE Trans. Comput. Soc. Syst. 7: 907-914 ,TCSS,Unranked
73,Information Theoretical Analysis of Unfair Rating Attacks Under Subjectivity.,2020,"Dongxia Wang, Tim Muller, Jie Zhang, Yang Liu",IEEE Trans. Inf. Forensics Secur. 15: 816-828 ,TIFS,Unranked
74,An Attentional Recurrent Neural Network for Personalized Next Location Recommendation.,2020,"Qing Guo, Zhu Sun, Jie Zhang, Yin-Leng Theng",AAAI 2020: 83-90,AAAI,A*
75,A Skip-Connected Evolving Recurrent Neural Network for Data Stream Classification under Label Latency Scenario.,2020,"Monidipa Das, Mahardhika Pratama, Jie Zhang, Yew-Soon Ong",AAAI 2020: 3717-3724,AAAI,A*
76,AATEAM: Achieving the Ad Hoc Teamwork by Employing the Attention Mechanism.,2020,"Shuo Chen, Ewa Andrejczuk, Zhiguang Cao, Jie Zhang",AAAI 2020: 7095-7102,AAAI,A*
77,COBRA: Context-Aware Bernoulli Neural Networks for Reputation Assessment.,2020,"Leonid Zeynalvand, Tie Luo, Jie Zhang",AAAI 2020: 7317-7324,AAAI,A*
78,Multi-Channel Sellers Traffic Allocation in Large-scale E-commerce Promotion.,2020,"Shen Xin, Yizhou Ye, Martin Ester, Cheng Long, Jie Zhang, Zhao Li, Kaiying Yuan, Yanghua Li",CIKM 2020: 2845-2852,CIKM,A
79,Efficient Community Search over Large Directed Graph: An Augmented Index-based Approach.,2020,"Yankai Chen, Jie Zhang, Yixiang Fang, Xin Cao, Irwin King",IJCAI 2020: 3544-3550,IJCAI,A*
80,An Interactive Multi-Task Learning Framework for Next POI Recommendation with Uncertain Check-ins.,2020,"Lu Zhang, Zhu Sun, Jie Zhang, Yu Lei, Chen Li, Ziqing Wu, Horst Kloeden, Felix Klanner",IJCAI 2020: 3551-3557,IJCAI,A*
81,Learning to Dispatch for Job Shop Scheduling via Deep Reinforcement Learning.,2020,"Cong Zhang, Wen Song, Zhiguang Cao, Jie Zhang, Puay Siew Tan, Chi Xu",NeurIPS 2020,NIPS,Unranked
82,Are We Evaluating Rigorously? Benchmarking Recommendation for Reproducible Evaluation and Fair Comparison.,2020,"Zhu Sun, Di Yu, Hui Fang, Jie Yang, Xinghua Qu, Jie Zhang, Cong Geng",RecSys 2020: 23-32,RECSYS,Unranked
83,A Re-visit of the Popularity Baseline in Recommender Systems.,2020,"Yitong Ji, Aixin Sun, Jie Zhang, Chenliang Li",SIGIR 2020: 1749-1752,SIGIR,A*
84,A Re-visit of the Popularity Baseline in Recommender Systems.,2020,"Yitong Ji, Aixin Sun, Jie Zhang, Chenliang Li",CoRR abs/2005.13829 ,CORR,Unranked
85,On Offline Evaluation of Recommender Systems.,2020,"Yitong Ji, Aixin Sun, Jie Zhang, Chenliang Li",CoRR abs/2010.11060 ,CORR,Unranked
86,Learning to Dispatch for Job Shop Scheduling via Deep Reinforcement Learning.,2020,"Cong Zhang, Wen Song, Zhiguang Cao, Jie Zhang, Puay Siew Tan, Chi Xu",CoRR abs/2010.12367 ,CORR,Unranked
87,Delayed Feedback Modeling for the Entire Space Conversion Rate Prediction.,2020,"Yanshi Wang, Jie Zhang, Qing Da, Anxiang Zeng",CoRR abs/2011.11826 ,CORR,Unranked
88,Multi-Decoder Attention Model with Embedding Glimpse for Solving Vehicle Routing Problems.,2020,"Liang Xin, Wen Song, Zhiguang Cao, Jie Zhang",CoRR abs/2012.10638 ,CORR,Unranked
89,Which Channel to Ask My Question?: Personalized Customer Service Request Stream Routing Using Deep Reinforcement Learning.,2019,"Zining Liu, Chong Long, Xiaolu Lu, Zehong Hu, Jie Zhang, Yafang Wang",IEEE Access 7: 107744-107756 ,ACCESS,Unranked
90,Research commentary on recommendations with side information: A survey and research directions.,2019,"Zhu Sun, Qing Guo, Jie Yang, Hui Fang, Guibing Guo, Jie Zhang, Robin Burke",Electron. Commer. Res. Appl. 37 ,ECRA,Unranked
91,Improving IoT Data Quality in Mobile Crowd Sensing: A Cross Validation Approach.,2019,"Tie Luo, Jianwei Huang, Salil S. Kanhere, Jie Zhang, Sajal K. Das",IEEE Internet Things J. 6: 5651-5664 ,IOTJ,Unranked
92,A Sampling Approach for Proactive Project Scheduling under Generalized Time-dependent Workability Uncertainty.,2019,"Wen Song, Donghun Kang, Jie Zhang, Zhiguang Cao, Hui Xi",J. Artif. Intell. Res. 64: 385-427 ,JAIR,Unranked
93,Securing Android App Markets via Modeling and Predicting Malware Spread Between Markets.,2019,"Guozhu Meng, Matthew Patrick, Yinxing Xue, Yang Liu, Jie Zhang",IEEE Trans. Inf. Forensics Secur. 14: 1944-1959 ,TIFS,Unranked
94,Exploring Communities in Large Profiled Graphs.,2019,"Yankai Chen, Yixiang Fang, Reynold Cheng, Yun Li, Xiaojun Chen, Jie Zhang",IEEE Trans. Knowl. Data Eng. 31: 1624-1629 ,TKDE,Unranked
95,Introduction to the Special Section on Trust and AI.,2019,"Jie Zhang, Jamal Bentahar, Rino Falcone, Timothy J. Norman, Murat Sensoy",ACM Trans. Internet Techn. 19 ,TOIT,Unranked
96,Supervised User Ranking in Signed Social Networks.,2019,"Xiaoming Li, Hui Fang, Jie Zhang",AAAI 2019: 184-191,AAAI,A*
97,General Robustness Evaluation of Incentive Mechanism against Bounded Rationality Using Continuum-Armed Bandits.,2019,"Zehong Hu, Jie Zhang, Zhao Li",AAAI 2019: 6070-6078,AAAI,A*
98,Fraud Regulating Policy for E-Commerce via Constrained Contextual Bandits.,2019,"Zehong Hu, Zhen Wang, Zhao Li, Shichang Hu, Shasha Ruan, Jie Zhang",AAMAS 2019: 1377-1385,ATAL,Unranked
99,Exploring Communities in Large Profiled Graphs (Extended Abstract).,2019,"Yankai Chen, Yixiang Fang, Reynold Cheng, Yun Li, Xiaojun Chen, Jie Zhang",ICDE 2019: 2159-2160,ICDE,A*
100,MUSE-RNN: A Multilayer Self-Evolving Recurrent Neural Network for Data Stream Classification.,2019,"Monidipa Das, Mahardhika Pratama, Septiviana Savitri, Jie Zhang",ICDM 2019: 110-119,ICDM,A*
101,Modeling Heterogeneous Influences for Point-of-Interest Recommendation in Location-Based Social Networks.,2019,"Qing Guo, Zhu Sun, Jie Zhang, Yin-Leng Theng",ICWE 2019: 72-80,ICWE,B
102,ATSIS: Achieving the Ad hoc Teamwork by Sub-task Inference and Selection.,2019,"Shuo Chen, Ewa Andrejczuk, Athirai Aravazhi Irissappane, Jie Zhang",IJCAI 2019: 172-179,IJCAI,A*
103,Exploring Communities in Large Profiled Graphs.,2019,"Yankai Chen, Yixiang Fang, Reynold Cheng, Yun Li, Xiaojun Chen, Jie Zhang",CoRR abs/1901.05451 ,CORR,Unranked
104,Research Commentary on Recommendations with Side Information: A Survey and Research Directions.,2019,"Zhu Sun, Qing Guo, Jie Yang, Hui Fang, Guibing Guo, Jie Zhang, Robin Burke",CoRR abs/1909.12807 ,CORR,Unranked
105,Attentive Knowledge Graph Embedding for Personalized Recommendation.,2019,"Xiao Sha, Zhu Sun, Jie Zhang",CoRR abs/1910.08288 ,CORR,Unranked
106,Which Channel to Ask My Question? Personalized Customer Service RequestStream Routing using DeepReinforcement Learning.,2019,"Zining Liu, Chong Long, Xiaolu Lu, Zehong Hu, Jie Zhang, Yafang Wang",CoRR abs/1911.10521 ,CORR,Unranked
107,Learning Improvement Heuristics for Solving the Travelling Salesman Problem.,2019,"Yaoxin Wu, Wen Song, Zhiguang Cao, Jie Zhang, Andrew Lim",CoRR abs/1912.05784 ,CORR,Unranked
108,COBRA: Context-aware Bernoulli Neural Networks for Reputation Assessment.,2019,"Leonid Zeynalvand, Tie Luo, Jie Zhang",CoRR abs/1912.08446 ,CORR,Unranked
109,Learning Variable Ordering Heuristics for Solving Constraint Satisfaction Problems.,2019,"Wen Song, Zhiguang Cao, Jie Zhang, Andrew Lim",CoRR abs/1912.10762 ,CORR,Unranked
110,A generalized stereotype learning approach and its instantiation in trust modeling.,2018,"Hui Fang, Jie Zhang, Murat Sensoy",Electron. Commer. Res. Appl. 30: 149-158 ,ECRA,Unranked
111,BPRH: Bayesian personalized ranking for heterogeneous implicit feedback.,2018,"Huihuai Qiu, Yun Liu, Guibing Guo, Zhu Sun, Jie Zhang, Hai Thanh Nguyen",Inf. Sci. 453: 80-98 ,ISCI,Unranked
112,"ACM UMAP 2018 - User Modeling, Adaptation and Personalization: 8-11 July, 2018 at NTU, Singapore.",2018,"Jie Zhang, Tanja Mitrovic, David Chin, Li Chen",SIGWEB Newsl. 2018: 2:1-2:5 ,SIGWEB,Unranked
113,An agent-based simulation system for multi-project scheduling under uncertainty.,2018,"Wen Song, Hui Xi, Donghun Kang, Jie Zhang",Simul. Model. Pract. Theory 86: 187-203 ,SIMPRA,Unranked
114,Toward General Robustness Evaluation of Incentive Mechanism Against Bounded Rationality.,2018,"Zehong Hu, Jie Zhang",IEEE Trans. Comput. Soc. Syst. 5: 698-712 ,TCSS,Unranked
115,A Bayesian Multiagent Trust Model for Social Networks.,2018,"Noel Sardana, Robin Cohen, Jie Zhang, Shuo Chen",IEEE Trans. Comput. Soc. Syst. 5: 995-1008 ,TCSS,Unranked
116,A Multiagent-Based Approach for Vehicle Routing by Considering Both Arriving on Time and Total Travel Time.,2018,"Zhiguang Cao, Hongliang Guo, Jie Zhang",ACM Trans. Intell. Syst. Technol. 9: 25:1-25:21 ,TIST,Unranked
117,FILE: A Novel Framework for Predicting Social Status in Signed Networks.,2018,"Xiaoming Li, Hui Fang, Jie Zhang",AAAI 2018: 330-337,AAAI,A*
118,POMDP-Based Decision Making for Fast Event Handling in VANETs.,2018,"Shuo Chen, Athirai Aravazhi Irissappane, Jie Zhang",AAAI 2018: 4646-4653,AAAI,A*
119,Risk-Aware Proactive Scheduling via Conditional Value-at-Risk.,2018,"Wen Song, Donghun Kang, Jie Zhang, Hui Xi",AAAI 2018: 6278-6285,AAAI,A*
120,An Operation Network for Abstractive Sentence Compression.,2018,"Naitong Yu, Jie Zhang, Minlie Huang, Xiaoyan Zhu",COLING 2018: 1065-1076,COLING,B
121,MASA: Multi-Agent Subjectivity Alignment for Trustworthy Internet of Things.,2018,"Leonid Zeynalvand, Jie Zhang, Shuo Chen, Tony T. Luo",FUSION 2018: 2013-2020,FUSION,C
122,A Novel Strategy for Active Task Assignment in Crowd Labeling.,2018,"Zehong Hu, Jie Zhang",IJCAI 2018: 1538-1545,IJCAI,A*
123,Inference Aided Reinforcement Learning for Incentive Mechanism Design in Crowdsourcing.,2018,"Zehong Hu, Yitao Liang, Jie Zhang, Zhao Li, Yang Liu",NeurIPS 2018: 5512-5522,NIPS,Unranked
124,Recurrent knowledge graph embedding for effective recommendation.,2018,"Zhu Sun, Jie Yang, Jie Zhang, Alessandro Bozzon, Long-Kai Huang, Chi Xu",RecSys 2018: 297-305,RECSYS,Unranked
125,Who is Your Best Friend?: Ranking Social Network Friends According to Trust Relationship.,2018,"Xiaoming Li, Hui Fang, Qing Yang, Jie Zhang",UMAP 2018: 301-309,UM,Unranked
126,"Proceedings of the 26th Conference on User Modeling, Adaptation and Personalization, UMAP 2018, Singapore, July 08-11, 2018.",2018,"Tanja Mitrovic, Jie Zhang, Li Chen, David Chin",ACM 2018 ,UM,Unranked
127,"Adjunct Publication of the 26th Conference on User Modeling, Adaptation and Personalization, UMAP 2018, Singapore, July 08-11, 2018.",2018,"Tanja Mitrovic, Jie Zhang, Li Chen, David Chin",ACM 2018 ,UM,Unranked
128,Inference Aided Reinforcement Learning for Incentive Mechanism Design in Crowdsourcing.,2018,"Zehong Hu, Yitao Liang, Yang Liu, Jie Zhang",CoRR abs/1806.00206 ,CORR,Unranked
129,Filtering unfair ratings from dishonest advisors in multi-criteria e-markets: a biclustering-based approach.,2017,"Athirai Aravazhi Irissappane, Jie Zhang",Auton. Agents Multi Agent Syst. 31: 36-65 ,AAMAS,A*
130,A multi-unit combinatorial auction based approach for decentralized multi-project scheduling.,2017,"Wen Song, Donghun Kang, Jie Zhang, Hui Xi",Auton. Agents Multi Agent Syst. 31: 1548-1577 ,AAMAS,A*
131,Artificial Intelligence Research in Singapore: Assisting the Development of a Smart Nation.,2017,"Pradeep Varakantham, Bo An, Bryan Low, Jie Zhang",AI Mag. 38: 102-105 ,AIM,Unranked
132,Measuring similarity of users with qualitative preferences for service selection.,2017,"Hongbing Wang, Hualan Wang, Guibing Guo, Yangyu Tang, Jie Zhang",Knowl. Inf. Syst. 51: 561-594 ,KAIS,Unranked
133,Factored similarity models with social trust for top-N item recommendation.,2017,"Guibing Guo, Jie Zhang, Feida Zhu, Xingwei Wang",Knowl. Based Syst. 122: 17-25 ,KBS,Unranked
134,CONGRESS: A Hybrid Reputation System for Coping with Rating Subjectivity.,2017,"Yuan Liu, Jie Zhang, Quanyan Zhu, Xingwei Wang",IEEE Trans. Comput. Soc. Syst. 4: 163-178 ,TCSS,Unranked
135,Routing Multiple Vehicles Cooperatively: Minimizing Road Network Breakdown Probability.,2017,"Hongliang Guo, Zhiguang Cao, Madhavan Seshadri, Jie Zhang, Dusit Niyato, Ulrich Fastenrath",IEEE Trans. Emerg. Top. Comput. Intell. 1: 112-124 ,TETCI,Unranked
