,Title,Year,Authors,Journal,Journal Acronym,Rank
142,"""Click"" Is Not Equal to ""Like"": Counterfactual Recommendation for Mitigating Clickbait Issue.",2020,"Wenjie Wang, Fuli Feng, Xiangnan He, Hanwang Zhang, Tat-Seng Chua",CoRR abs/2009.09945 ,CORR,Unranked
143,Causal Intervention for Weakly-Supervised Semantic Segmentation.,2020,"Dong Zhang, Hanwang Zhang, Jinhui Tang, Xiansheng Hua, Qianru Sun",CoRR abs/2009.12547 ,CORR,Unranked
144,Long-Tailed Classification by Keeping the Good and Removing the Bad Momentum Causal Effect.,2020,"Kaihua Tang, Jianqiang Huang, Hanwang Zhang",CoRR abs/2009.12991 ,CORR,Unranked
145,Interventional Few-Shot Learning.,2020,"Zhongqi Yue, Hanwang Zhang, Qianru Sun, Xian-Sheng Hua",CoRR abs/2009.13000 ,CORR,Unranked
146,Special issue on multimedia recommendation and multi-modal data analysis.,2019,"Xiangnan He, Zhenguang Liu, Hanwang Zhang, Chong-Wah Ngo, Svebor Karaman, Yongfeng Zhang",Multim. Syst. 25: 591-592 ,MMS,Unranked
147,More is Better: Precise and Detailed Image Captioning Using Online Positive Recall and Missing Concepts Mining.,2019,"Mingxing Zhang, Yang Yang, Hanwang Zhang, Yanli Ji, Heng Tao Shen, Tat-Seng Chua",IEEE Trans. Image Process. 28: 32-44 ,TIP,Unranked
148,Learning to Embed Sentences Using Attentive Recursive Trees.,2019,"Jiaxin Shi, Lei Hou, Juanzi Li, Zhiyuan Liu, Hanwang Zhang",AAAI 2019: 6991-6998,AAAI,A*
149,DeepChannel: Salience Estimation by Contrastive Learning for Extractive Document Summarization.,2019,"Jiaxin Shi, Chen Liang, Lei Hou, Juanzi Li, Zhiyuan Liu, Hanwang Zhang",AAAI 2019: 6999-7006,AAAI,A*
150,Learning to Compose Dynamic Tree Structures for Visual Contexts.,2019,"Kaihua Tang, Hanwang Zhang, Baoyuan Wu, Wenhan Luo, Wei Liu",CVPR 2019: 6619-6628,CVPR,A*
151,Recursive Visual Attention in Visual Dialog.,2019,"Yulei Niu, Hanwang Zhang, Manli Zhang, Jianhong Zhang, Zhiwu Lu, Ji-Rong Wen",CVPR 2019: 6679-6688,CVPR,A*
152,Explainable and Explicit Visual Reasoning Over Scene Graphs.,2019,"Jiaxin Shi, Hanwang Zhang, Juanzi Li",CVPR 2019: 8376-8384,CVPR,A*
153,Auto-Encoding Scene Graphs for Image Captioning.,2019,"Xu Yang, Kaihua Tang, Hanwang Zhang, Jianfei Cai",CVPR 2019: 10685-10694,CVPR,A*
154,Making History Matter: History-Advantage Sequence Training for Visual Dialog.,2019,"Tianhao Yang, Zheng-Jun Zha, Hanwang Zhang",ICCV 2019: 2561-2569,ICCV,A*
155,Learning to Collocate Neural Modules for Image Captioning.,2019,"Xu Yang, Hanwang Zhang, Jianfei Cai",ICCV 2019: 4249-4259,ICCV,A*
156,Counterfactual Critic Multi-Agent Training for Scene Graph Generation.,2019,"Long Chen, Hanwang Zhang, Jun Xiao, Xiangnan He, Shiliang Pu, Shih-Fu Chang",ICCV 2019: 4612-4622,ICCV,A*
157,Learning to Assemble Neural Module Tree Networks for Visual Grounding.,2019,"Daqing Liu, Hanwang Zhang, Feng Wu, Zheng-Jun Zha",ICCV 2019: 4672-4681,ICCV,A*
158,Learning Using Privileged Information for Food Recognition.,2019,"Lei Meng, Long Chen, Xun Yang, Dacheng Tao, Hanwang Zhang, Chunyan Miao, Tat-Seng Chua",ACM Multimedia 2019: 557-565,MM,Unranked
159,Question-Aware Tube-Switch Network for Video Question Answering.,2019,"Tianhao Yang, Zheng-Jun Zha, Hongtao Xie, Meng Wang, Hanwang Zhang",ACM Multimedia 2019: 1184-1192,MM,Unranked
160,Single-shot Semantic Image Inpainting with Densely Connected Generative Networks.,2019,"Ling Shen, Richang Hong, Haoran Zhang, Hanwang Zhang, Meng Wang",ACM Multimedia 2019: 1861-1869,MM,Unranked
161,Making History Matter: Gold-Critic Sequence Training for Visual Dialog.,2019,"Tianhao Yang, Zheng-Jun Zha, Hanwang Zhang",CoRR abs/1902.09326 ,CORR,Unranked
162,Learning to Collocate Neural Modules for Image Captioning.,2019,"Xu Yang, Hanwang Zhang, Jianfei Cai",CoRR abs/1904.08608 ,CORR,Unranked
163,Learning to Compose and Reason with Language Tree Structures for Visual Grounding.,2019,"Richang Hong, Daqing Liu, Xiaoyu Mo, Xiangnan He, Hanwang Zhang",CoRR abs/1906.01784 ,CORR,Unranked
164,Context-Aware Visual Policy Network for Fine-Grained Image Captioning.,2019,"Zheng-Jun Zha, Daqing Liu, Hanwang Zhang, Yongdong Zhang, Feng Wu",CoRR abs/1906.02365 ,CORR,Unranked
165,Referring Expression Grounding by Marginalizing Scene Graph Likelihood.,2019,"Daqing Liu, Hanwang Zhang, Zheng-Jun Zha, Fanglin Wang",CoRR abs/1906.03561 ,CORR,Unranked
166,Variational Context: Exploiting Visual and Textual Context for Grounding Referring Expressions.,2019,"Yulei Niu, Hanwang Zhang, Zhiwu Lu, Shih-Fu Chang",CoRR abs/1907.03609 ,CORR,Unranked
167,Two Causal Principles for Improving Visual Dialog.,2019,"Jiaxin Qi, Yulei Niu, Jianqiang Huang, Hanwang Zhang",CoRR abs/1911.10496 ,CORR,Unranked
168,Self-Supervised Video Hashing With Hierarchical Binary Auto-Encoder.,2018,"Jingkuan Song, Hanwang Zhang, Xiangpeng Li, Lianli Gao, Meng Wang, Richang Hong",IEEE Trans. Image Process. 27: 3210-3221 ,TIP,Unranked
169,Attributed Social Network Embedding.,2018,"Lizi Liao, Xiangnan He, Hanwang Zhang, Tat-Seng Chua",IEEE Trans. Knowl. Data Eng. 30: 2257-2270 ,TKDE,Unranked
170,Learning to Guide Decoding for Image Captioning.,2018,"Wenhao Jiang, Lin Ma, Xinpeng Chen, Hanwang Zhang, Wei Liu",AAAI 2018: 6959-6966,AAAI,A*
171,Zero-Shot Visual Recognition Using Semantics-Preserving Adversarial Embedding Networks.,2018,"Long Chen, Hanwang Zhang, Jun Xiao, Wei Liu, Shih-Fu Chang",CVPR 2018: 1043-1052,CVPR,A*
172,Grounding Referring Expressions in Images by Variational Context.,2018,"Hanwang Zhang, Yulei Niu, Shih-Fu Chang",CVPR 2018: 4158-4166,CVPR,A*
173,Shuffle-Then-Assemble: Learning Object-Agnostic Visual Relationship Features.,2018,"Xu Yang, Hanwang Zhang, Jianfei Cai",ECCV  2018: 38-54,ECCV,A*
174,Multi-Level Policy and Reward Reinforcement Learning for Image Captioning.,2018,"Anan Liu, Ning Xu, Hanwang Zhang, Weizhi Nie, Yuting Su, Yongdong Zhang",IJCAI 2018: 821-827,IJCAI,A*
175,Discrete Factorization Machines for Fast Feature-based Recommendation.,2018,"Han Liu, Xiangnan He, Fuli Feng, Liqiang Nie, Rui Liu, Hanwang Zhang",IJCAI 2018: 3449-3455,IJCAI,A*
176,"Objects, Relationships, and Context in Visual Data.",2018,"Hanwang Zhang, Qianru Sun",ICMR 2018: 7,MIR,Unranked
177,Recommendation Technologies for Multimedia Content.,2018,"Xiangnan He, Hanwang Zhang, Tat-Seng Chua",ICMR 2018: 8,MIR,Unranked
178,Context-Aware Visual Policy Network for Sequence-Level Image Captioning.,2018,"Daqing Liu, Zheng-Jun Zha, Hanwang Zhang, Yongdong Zhang, Feng Wu",ACM Multimedia 2018: 1416-1424,MM,Unranked
179,Venue Prediction for Social Images by Exploiting Rich Temporal Patterns in LBSNs.,2018,"Jingyuan Chen, Xiangnan He, Xuemeng Song, Hanwang Zhang, Liqiang Nie, Tat-Seng Chua",MMM  2018: 327-339,MMM,B
180,Low-shot Learning via Covariance-Preserving Adversarial Augmentation Networks.,2018,"Hang Gao, Zheng Shou, Alireza Zareian, Hanwang Zhang, Shih-Fu Chang",NeurIPS 2018: 983-993,NIPS,Unranked
181,Self-Supervised Video Hashing with Hierarchical Binary Auto-encoder.,2018,"Jingkuan Song, Hanwang Zhang, Xiangpeng Li, Lianli Gao, Meng Wang, Richang Hong",CoRR abs/1802.02305 ,CORR,Unranked
182,Learning to Guide Decoding for Image Captioning.,2018,"Wenhao Jiang, Lin Ma, Xinpeng Chen, Hanwang Zhang, Wei Liu",CoRR abs/1804.00887 ,CORR,Unranked
183,Discrete Factorization Machines for Fast Feature-based Recommendation.,2018,"Han Liu, Xiangnan He, Fuli Feng, Liqiang Nie, Rui Liu, Hanwang Zhang",CoRR abs/1805.02232 ,CORR,Unranked
184,Shuffle-Then-Assemble: Learning Object-Agnostic Visual Relationship Features.,2018,"Xu Yang, Hanwang Zhang, Jianfei Cai",CoRR abs/1808.00171 ,CORR,Unranked
185,Context-Aware Visual Policy Network for Sequence-Level Image Captioning.,2018,"Daqing Liu, Zheng-Jun Zha, Hanwang Zhang, Yongdong Zhang, Feng Wu",CoRR abs/1808.05864 ,CORR,Unranked
186,Stochastic Video Long-term Interpolation.,2018,"Qiangeng Xu, Hanwang Zhang, Weiyue Wang, Peter N. Belhumeur, Ulrich Neumann",CoRR abs/1809.00263 ,CORR,Unranked
187,Low-shot Learning via Covariance-Preserving Adversarial Augmentation Networks.,2018,"Hang Gao, Zheng Shou, Alireza Zareian, Hanwang Zhang, Shih-Fu Chang",CoRR abs/1810.11730 ,CORR,Unranked
188,Learning to Embed Sentences Using Attentive Recursive Trees.,2018,"Jiaxin Shi, Lei Hou, Juanzi Li, Zhiyuan Liu, Hanwang Zhang",CoRR abs/1811.02338 ,CORR,Unranked
189,DeepChannel: Salience Estimation by Contrastive Learning for Extractive Document Summarization.,2018,"Jiaxin Shi, Chen Liang, Lei Hou, Juanzi Li, Zhiyuan Liu, Hanwang Zhang",CoRR abs/1811.02394 ,CORR,Unranked
190,Explainable and Explicit Visual Reasoning over Scene Graphs.,2018,"Jiaxin Shi, Hanwang Zhang, Juanzi Li",CoRR abs/1812.01855 ,CORR,Unranked
191,Learning to Compose Dynamic Tree Structures for Visual Contexts.,2018,"Kaihua Tang, Hanwang Zhang, Baoyuan Wu, Wenhan Luo, Wei Liu",CoRR abs/1812.01880 ,CORR,Unranked
192,Scene Dynamics: Counterfactual Critic Multi-Agent Training for Scene Graph Generation.,2018,"Long Chen, Hanwang Zhang, Jun Xiao, Xiangnan He, Shiliang Pu, Shih-Fu Chang",CoRR abs/1812.02347 ,CORR,Unranked
193,Auto-Encoding Scene Graphs for Image Captioning.,2018,"Xu Yang, Kaihua Tang, Hanwang Zhang, Jianfei Cai",CoRR abs/1812.02378 ,CORR,Unranked
194,Recursive Visual Attention in Visual Dialog.,2018,"Yulei Niu, Hanwang Zhang, Manli Zhang, Jianhong Zhang, Zhiwu Lu, Ji-Rong Wen",CoRR abs/1812.02664 ,CORR,Unranked
195,Explainability by Parsing: Neural Module Tree Networks for Natural Language Visual Grounding.,2018,"Daqing Liu, Hanwang Zhang, Zheng-Jun Zha, Feng Wu",CoRR abs/1812.03299 ,CORR,Unranked
196,Multi-view feature selection and classification for Alzheimer's Disease diagnosis.,2017,"Mingxing Zhang, Yang Yang, Fumin Shen, Hanwang Zhang, Yuan Wang",Multim. Tools Appl. 76: 10761-10775 ,MTA,Unranked
197,Erratum to: Multi-view feature selection and classification for Alzheimer's Disease Diagnosis.,2017,"Mingxing Zhang, Yang Yang, Fumin Shen, Hanwang Zhang, Yuan Wang",Multim. Tools Appl. 76: 10777-10778 ,MTA,Unranked
198,Event Classification in Microblogs via Social Tracking.,2017,"Yue Gao, Hanwang Zhang, Xibin Zhao, Shuicheng Yan",ACM Trans. Intell. Syst. Technol. 8: 35:1-35:14 ,TIST,Unranked
199,I Know What You Want to Express: Sentence Element Inference by Incorporating External Knowledge Base.,2017,"Xiaochi Wei, Heyan Huang, Liqiang Nie, Hanwang Zhang, Xianling Mao, Tat-Seng Chua",IEEE Trans. Knowl. Data Eng. 29: 344-358 ,TKDE,Unranked
200,"Matryoshka Peek: Toward Learning Fine-Grained, Robust, Discriminative Features for Product Search.",2017,"Zawlin Kyaw, Shuhan Qi, Ke Gao, Hanwang Zhang, Luming Zhang, Jun Xiao, Xuan Wang, Tat-Seng Chua",IEEE Trans. Multim. 19: 1272-1284 ,TMM,Unranked
201,Video Captioning With Attention-Based LSTM and Semantic Consistency.,2017,"Lianli Gao, Zhao Guo, Hanwang Zhang, Xing Xu, Heng Tao Shen",IEEE Trans. Multim. 19: 2045-2055 ,TMM,Unranked
202,VideoWhisper: Toward Discriminative Unsupervised Video Feature Learning With Attention-Based Recurrent Neural Networks.,2017,"Na Zhao, Hanwang Zhang, Richang Hong, Meng Wang, Tat-Seng Chua",IEEE Trans. Multim. 19: 2080-2092 ,TMM,Unranked
203,Deep Semantic Indexing Using Convolutional Localization Network with Region-Based Visual Attention for Image Database.,2017,"Mingxing Zhang, Yang Yang, Hanwang Zhang, Yanli Ji, Ning Xie, Heng Tao Shen",ADC 2017: 261-272,ADC,Australasian B
204,Visual Translation Embedding Network for Visual Relation Detection.,2017,"Hanwang Zhang, Zawlin Kyaw, Shih-Fu Chang, Tat-Seng Chua",CVPR 2017: 3107-3115,CVPR,A*
205,SCA-CNN: Spatial and Channel-Wise Attention in Convolutional Networks for Image Captioning.,2017,"Long Chen, Hanwang Zhang, Jun Xiao, Liqiang Nie, Jian Shao, Wei Liu, Tat-Seng Chua",CVPR 2017: 6298-6306,CVPR,A*
206,PPR-FCN: Weakly Supervised Visual Relation Detection via Parallel Pairwise R-FCN.,2017,"Hanwang Zhang, Zawlin Kyaw, Jinyang Yu, Shih-Fu Chang",ICCV 2017: 4243-4251,ICCV,A*
207,VIDEOWHISPER: Towards unsupervised learning of discriminative features of videos with RNN.,2017,"Na Zhao, Hanwang Zhang, Mingxing Zhang, Richang Hong, Meng Wang, Tat-Seng Chua",ICME 2017: 277-282,ICMCS,Unranked
208,Object trajectory proposal.,2017,"Xindi Shang, Tongwei Ren, Hanwang Zhang, Gangshan Wu, Tat-Seng Chua",ICME 2017: 331-336,ICMCS,Unranked
209,Extracting Generic Features of Artistic Style via Deep Convolutional Neural Network.,2017,"Lili Kong, Jiancheng Lv, Mao Li, Hanwang Zhang",ICVIP 2017: 119-123,ICVIP,Unranked
210,Attentional Factorization Machines: Learning the Weight of Feature Interactions via Attention Networks.,2017,"Jun Xiao, Hao Ye, Xiangnan He, Hanwang Zhang, Fei Wu, Tat-Seng Chua",IJCAI 2017: 3119-3125,IJCAI,A*
211,Improving Event Extraction via Multimodal Integration.,2017,"Tongtao Zhang, Spencer Whitehead, Hanwang Zhang, Hongzhi Li, Joseph G. Ellis, Lifu Huang, Wei Liu, Heng Ji, Shih-Fu Chang",ACM Multimedia 2017: 270-278,MM,Unranked
212,Enhancing Micro-video Understanding by Harnessing External Sounds.,2017,"Liqiang Nie, Xiang Wang, Jianglong Zhang, Xiangnan He, Hanwang Zhang, Richang Hong, Qi Tian",ACM Multimedia 2017: 1192-1200,MM,Unranked
213,Video Visual Relation Detection.,2017,"Xindi Shang, Tongwei Ren, Jingfan Guo, Hanwang Zhang, Tat-Seng Chua",ACM Multimedia 2017: 1300-1308,MM,Unranked
214,Video Question Answering via Gradually Refined Attention over Appearance and Motion.,2017,"Dejing Xu, Zhou Zhao, Jun Xiao, Fei Wu, Hanwang Zhang, Xiangnan He, Yueting Zhuang",ACM Multimedia 2017: 1645-1653,MM,Unranked
215,Attentive Collaborative Filtering: Multimedia Recommendation with Item- and Component-Level Attention.,2017,"Jingyuan Chen, Hanwang Zhang, Xiangnan He, Liqiang Nie, Wei Liu, Tat-Seng Chua",SIGIR 2017: 335-344,SIGIR,A*
216,Neural Collaborative Filtering.,2017,"Xiangnan He, Lizi Liao, Hanwang Zhang, Liqiang Nie, Xia Hu, Tat-Seng Chua",WWW 2017: 173-182,WWW,A*
217,Visual Translation Embedding Network for Visual Relation Detection.,2017,"Hanwang Zhang, Zawlin Kyaw, Shih-Fu Chang, Tat-Seng Chua",CoRR abs/1702.08319 ,CORR,Unranked
218,Attributed Social Network Embedding.,2017,"Lizi Liao, Xiangnan He, Hanwang Zhang, Tat-Seng Chua",CoRR abs/1705.04969 ,CORR,Unranked
219,PPR-FCN: Weakly Supervised Visual Relation Detection via Parallel Pairwise R-FCN.,2017,"Hanwang Zhang, Zawlin Kyaw, Jinyang Yu, Shih-Fu Chang",CoRR abs/1708.01956 ,CORR,Unranked
220,Attentional Factorization Machines: Learning the Weight of Feature Interactions via Attention Networks.,2017,"Jun Xiao, Hao Ye, Xiangnan He, Hanwang Zhang, Fei Wu, Tat-Seng Chua",CoRR abs/1708.04617 ,CORR,Unranked
221,Fast Matrix Factorization for Online Recommendation with Implicit Feedback.,2017,"Xiangnan He, Hanwang Zhang, Min-Yen Kan, Tat-Seng Chua",CoRR abs/1708.05024 ,CORR,Unranked
222,Neural Collaborative Filtering.,2017,"Xiangnan He, Lizi Liao, Hanwang Zhang, Liqiang Nie, Xia Hu, Tat-Seng Chua",CoRR abs/1708.05031 ,CORR,Unranked
223,Grounding Referring Expressions in Images by Variational Context.,2017,"Hanwang Zhang, Yulei Niu, Shih-Fu Chang",CoRR abs/1712.01892 ,CORR,Unranked
224,Zero-Shot Visual Recognition using Semantics-Preserving Adversarial Embedding Network.,2017,"Long Chen, Hanwang Zhang, Jun Xiao, Wei Liu, Shih-Fu Chang",CoRR abs/1712.01928 ,CORR,Unranked
225,Learning content-social influential features for influence analysis.,2016,"Na Zhao, Hanwang Zhang, Meng Wang, Richang Hong, Tat-Seng Chua",Int. J. Multim. Inf. Retr. 5: 137-149 ,IJMIR,Unranked
226,"L2, p-norm and sample constraint based feature selection and classification for AD diagnosis.",2016,"Mingxing Zhang, Yang Yang, Hanwang Zhang, Fumin Shen, Dongxiang Zhang",Neurocomputing 195: 104-111 ,IJON,Unranked
227,Binary representation learning in computer vision.,2016,"Fumin Shen, Hanwang Zhang, Yang Yang",Neurocomputing 213: 1-4 ,IJON,Unranked
228,Robust regression based face recognition with fast outlier removal.,2016,"Fumin Shen, Wankou Yang, Hanxi Li, Hanwang Zhang, Heng Tao Shen",Multim. Tools Appl. 75: 12535-12546 ,MTA,Unranked
229,Deep Fusion of Multiple Semantic Cues for Complex Event Recognition.,2016,"Xishan Zhang, Hanwang Zhang, Yongdong Zhang, Yang Yang, Meng Wang, Huan-Bo Luan, Jintao Li, Tat-Seng Chua",IEEE Trans. Image Process. 25: 1033-1046 ,TIP,Unranked
230,Deep Aging Face Verification With Large Gaps.,2016,"Luoqi Liu, Chao Xiong, Hanwang Zhang, Zhiheng Niu, Meng Wang, Shuicheng Yan",IEEE Trans. Multim. 18: 64-75 ,TMM,Unranked
231,Learning from Collective Intelligence: Feature Learning Using Social Images and Tags.,2016,"Hanwang Zhang, Xindi Shang, Huan-Bo Luan, Meng Wang, Tat-Seng Chua",ACM Trans. Multim. Comput. Commun. Appl. 13: 1:1-1:23 ,TOMCCAP,Unranked
232,Discrete Image Hashing Using Large Weakly Annotated Photo Collections.,2016,"Hanwang Zhang, Na Zhao, Xindi Shang, Huan-Bo Luan, Tat-Seng Chua",AAAI 2016: 3669-3675,AAAI,A*
233,Online Collaborative Learning for Open-Vocabulary Visual Classifiers.,2016,"Hanwang Zhang, Xindi Shang, Wenzhuo Yang, Huan Xu, Huan-Bo Luan, Tat-Seng Chua",CVPR 2016: 2809-2817,CVPR,A*
234,Saliency meets spatial quantization: A practical framework for large scale product search.,2016,"Shuhan Qi, Kyaw Zawlin, Hanwang Zhang, Xuan Wang, Ke Gao, Lin Yao, Tat-Seng Chua",ICME Workshops 2016: 1-6,ICMCS,Unranked
235,Mental Visual Indexing: Towards Fast Video Browsing.,2016,"Richang Hong, Jun He, Hanwang Zhang, Tat-Seng Chua",ACM Multimedia 2016: 621-625,MM,Unranked
236,An Intention-Aware Interactive System for Mobile Video Browsing.,2016,"Jun He, Hanwang Zhang, Ling Shen, Richang Hong, Tat-Seng Chua",ACM Multimedia 2016: 705-707,MM,Unranked
237,Play and Rewind: Optimizing Binary Representations of Videos by Self-Supervised Temporal Hashing.,2016,"Hanwang Zhang, Meng Wang, Richang Hong, Tat-Seng Chua",ACM Multimedia 2016: 781-790,MM,Unranked
238,Micro Tells Macro: Predicting the Popularity of Micro-Videos via a Transductive Model.,2016,"Jingyuan Chen, Xuemeng Song, Liqiang Nie, Xiang Wang, Hanwang Zhang, Tat-Seng Chua",ACM Multimedia 2016: 898-907,MM,Unranked
239,Deep Learning Generic Features for Cross-Media Retrieval.,2016,"Xindi Shang, Hanwang Zhang, Tat-Seng Chua",MMM  2016: 264-275,MMM,B
240,Mental Visual Browsing.,2016,"Jun He, Xindi Shang, Hanwang Zhang, Tat-Seng Chua",MMM  2016: 424-428,MMM,B
241,Discrete Collaborative Filtering.,2016,"Hanwang Zhang, Fumin Shen, Wei Liu, Xiangnan He, Huanbo Luan, Tat-Seng Chua",SIGIR 2016: 325-334,SIGIR,A*
242,Fast Matrix Factorization for Online Recommendation with Implicit Feedback.,2016,"Xiangnan He, Hanwang Zhang, Min-Yen Kan, Tat-Seng Chua",SIGIR 2016: 549-558,SIGIR,A*
243,SCA-CNN: Spatial and Channel-wise Attention in Convolutional Networks for Image Captioning.,2016,"Long Chen, Hanwang Zhang, Jun Xiao, Liqiang Nie, Jian Shao, Tat-Seng Chua",CoRR abs/1611.05594 ,CORR,Unranked
244,Multimedia Summarization for Social Events in Microblog Stream.,2015,"Jingwen Bian, Yang Yang, Hanwang Zhang, Tat-Seng Chua",IEEE Trans. Multim. 17: 216-228 ,TMM,Unranked
245,Enhancing Video Event Recognition Using Automatically Constructed Semantic-Visual Knowledge Base.,2015,"Xishan Zhang, Yang Yang, Yongdong Zhang, Huan-Bo Luan, Jintao Li, Hanwang Zhang, Tat-Seng Chua",IEEE Trans. Multim. 17: 1562-1575 ,TMM,Unranked
246,Learning Image and User Features for Recommendation in Social Networks.,2015,"Xue Geng, Hanwang Zhang, Jingwen Bian, Tat-Seng Chua",ICCV 2015: 4274-4282,ICCV,A*
247,Visual Coding in a Semantic Hierarchy.,2015,"Yang Yang, Hanwang Zhang, Mingxing Zhang, Fumin Shen, Xuelong Li",ACM Multimedia 2015: 59-68,MM,Unranked
248,Multi-view Semi-supervised Learning for Web Image Annotation.,2015,"Mengqiu Hu, Yang Yang, Hanwang Zhang, Fumin Shen, Jie Shao, Fuhao Zou",ACM Multimedia 2015: 947-950,MM,Unranked
249,"Learning Features from Large-Scale, Noisy and Social Image-Tag Collection.",2015,"Hanwang Zhang, Xindi Shang, Huan-Bo Luan, Yang Yang, Tat-Seng Chua",ACM Multimedia 2015: 1079-1082,MM,Unranked
250,Hashing with Inductive Supervised Learning.,2015,"Mingxing Zhang, Fumin Shen, Hanwang Zhang, Ning Xie, Wankou Yang",PCM  2015: 447-455,PCM,Unranked
251,Robust (Semi) Nonnegative Graph Embedding.,2014,"Hanwang Zhang, Zheng-Jun Zha, Yang Yang, Shuicheng Yan, Tat-Seng Chua",IEEE Trans. Image Process. 23: 2996-3012 ,TIP,Unranked
252,Attribute-Augmented Semantic Hierarchy: Towards a Unified Framework for Content-Based Image Retrieval.,2014,"Hanwang Zhang, Zheng-Jun Zha, Yang Yang, Shuicheng Yan, Yue Gao, Tat-Seng Chua",ACM Trans. Multim. Comput. Commun. Appl. 11: 21:1-21:21 ,TOMCCAP,Unranked
253,Image Tagging with Social Assistance.,2014,"Yang Yang, Yue Gao, Hanwang Zhang, Jie Shao, Tat-Seng Chua",ICMR 2014: 81,MIR,Unranked
254,"Start from Scratch: Towards Automatically Identifying, Modeling, and Naming Visual Attributes.",2014,"Hanwang Zhang, Yang Yang, Huan-Bo Luan, Shuicheng Yan, Tat-Seng Chua",ACM Multimedia 2014: 187-196,MM,Unranked
255,Perception-Guided Multimodal Feature Fusion for Photo Aesthetics Assessment.,2014,"Luming Zhang, Yue Gao, Chao Zhang, Hanwang Zhang, Qi Tian, Roger Zimmermann",ACM Multimedia 2014: 237-246,MM,Unranked
256,One of a Kind: User Profiling by Social Curation.,2014,"Xue Geng, Hanwang Zhang, Zheng Song, Yang Yang, Huan-Bo Luan, Tat-Seng Chua",ACM Multimedia 2014: 567-576,MM,Unranked
257,Detecting Group Activities With Multi-Camera Context.,2013,"Zheng-Jun Zha, Hanwang Zhang, Meng Wang, Huan-Bo Luan, Tat-Seng Chua",IEEE Trans. Circuits Syst. Video Technol. 23: 856-869 ,TCSV,Unranked
258,Attribute-augmented semantic hierarchy: towards bridging semantic gap and intention gap in image retrieval.,2013,"Hanwang Zhang, Zheng-Jun Zha, Yang Yang, Shuicheng Yan, Yue Gao, Tat-Seng Chua",ACM Multimedia 2013: 33-42,MM,Unranked
259,"Robust Non-negative Graph Embedding: Towards noisy data, unreliable graphs, and noisy labels.",2012,"Hanwang Zhang, Zheng-Jun Zha, Shuicheng Yan, Meng Wang, Tat-Seng Chua",CVPR 2012: 2464-2471,CVPR,A*
260,Attribute feedback.,2012,"Hanwang Zhang, Zheng-Jun Zha, Shuicheng Yan, Jingwen Bian, Tat-Seng Chua",ACM Multimedia 2012: 79-88,MM,Unranked
261,Visual query attributes suggestion.,2012,"Jingwen Bian, Zheng-Jun Zha, Hanwang Zhang, Qi Tian, Tat-Seng Chua",ACM Multimedia 2012: 869-872,MM,Unranked
262,Attribute feedback.,2012,"Hanwang Zhang, Zheng-Jun Zha, Jingwen Bian, Yue Gao, Huan-Bo Luan, Tat-Seng Chua",ACM Multimedia 2012: 1339-1340,MM,Unranked
263,Web image interpretation: semi-supervised mining annotated words.,2009,"Fei Wu, Dingyin Xia, Yueting Zhuang, Hanwang Zhang, Wenhao Liu",ICME 2009: 1512-1515,ICMCS,Unranked
