,Name,Keywords,Website,Picture,Citations,Affiliation,Research Interest,Biography,Overall Rank
62,Lin Guosheng,Computer Science and Engineering,['https://guosheng.github.io/'],https://dr.ntu.edu.sg/cris/rp/fileservice/rp00483/57/?filename=gslin_1_2.JPG,12702.0,[],"['Computer Vision', 'Machine Learning']","Before moving to NTU Singapore, I was a research fellow at the Australian Centre for Robotic Vision (ACRV),  affiliated with The University of Adelaide. I completed my PhD degree at the University of Adelaide in 2014. I received my bachelor's and master's degree from the South China University of Technology (SCUT) in 2007 and 2010, respectively.",A*
63,Lu Shijian,"Computer Vision and Sensing, Neuroscience, Graphics and Interactive Computing, Economics, Smart Cities, Digital Economy, Disrupting the Future of Industry and Manufacturing, Smart Nation, Image and Video Analytics, Neurotechnology",['https://personal.ntu.edu.sg/shijian.lu/index.htm'],https://dr.ntu.edu.sg/cris/rp/fileservice/rp01128/57/?filename=Shijian3.jpg,14086.0,[],"['Image and video analytics', 'computer vision', 'machine learning']","Shijian received his PhD in electrical and computer engineering from the National University of Singapore. He is currently an Associate Professor with the School of Computer Science and Engineering, Nanyang Technological University (NTU), Singapore. His major research interests include image and video analytics, visual intelligence, and machine learning. He has published more than 100 international refereed journal and conference papers and co-authored up to10 patents in these research areas. Before joining in NTU, he took a number of leadership roles in the Institute for Infocomm Research (I2R), under the Agency for Science, Technology, and Research (A*SATR) in Singapore, including Head of Visual Attention Lab, Deputy Head of Satellite Department, Co-Chair of the Image and Pervasive Access Laboratory. He is currently an Associate Editor for the journal Pattern Recognition (PR) and Neurocomputing. He has also served in the program committee of a number of conferences such as the Senior Program Committee of the International Joint Conferences on Artificial Intelligence and Association for the Advancement of Artificial Intelligence.",A
64,Mohamed M Sabry,"Systems and Engineering Management, Computer Science and Engineering, Electrical and Electronic Engineering, Machines & Systems, Nanotechnology & Nano-Science, Computing Hardware and Architecture, Hardware and Embedded Systems",['http://www.ecs-97.webself.net/'],https://dr.ntu.edu.sg/cris/rp/fileservice/rp00314/57/?filename=image4.jpeg,1490.0,[],"['Computer Architecture', 'AI Hardware', 'System-Level Design', 'Emerging Technologies', 'Embedded Systems']","Mohamed M. Sabry obtained his Ph.D. from EPFL in 2013 and was a postdoc in Stanford University from 2014 till 2017. His primary research interests are system-level design and optimization and resource management of computing systems by leveraging the benefits of emerging technologies (for computing, storage, interconnect, and cooling) to boost computing performance and energy efficiency beyond what is achievable today from large-scale cloud to small-scale embedded domains.  This includes device-, circuit-, and architecture modeling, design-space exploration and hardware-software co-optimization. His work on Nanoengineered Computing System Technology (N3XT), under the supervision of Prof. Subhasish Mitra and Prof. H.-S. Philip Wong has received worldwide recognition in various news press. It shows the prospects of monolithic 3D computing systems enabled by emerging nanotechnologies, such as carbon nanotubes and resistive memories.He has been awarded the Swiss National Science Foundation Early Post-Doctoral Mobility Fellowship in 2013.",B
65,Erik Cambria,"Computer Science and Engineering, Computational Intelligence, Information Sciences and Systems, Artificial and Augmented Intelligence, Machine-Person Interoperability, Affective Computing, Sentiment Analysis, Commonsense Reasoning, Neurosymbolic AI","['https://sentic.net', 'https://orcid.org/0000-0002-3030-1280']",https://dr.ntu.edu.sg/cris/rp/fileservice/rp00927/57/?filename=erik ntu.jpeg,45539.0,[],"['affective computing', 'sentiment analysis', 'multimodal interaction', 'commonsense reasoning', 'sentic computing']","Erik Cambria is the Founder of SenticNet, a Singapore-based company offering B2B sentiment analysis services, and a Professor at Nanyang Technological University, where he also holds the appointment of Provost Chair in Computer Science and Engineering. Prior to joining NTU, he worked at Microsoft Research Asia (Beijing) and HP Labs India (Bangalore) and earned his PhD through a joint programme between the University of Stirling and MIT Media Lab. His research focuses on neurosymbolic AI for explainable natural language processing in domains like sentiment analysis, dialogue systems, and financial forecasting. He is recipient of several awards, e.g., IEEE Outstanding Career Award, was listed among the AI's 10 to Watch, and was featured in Forbes as one of the 5 People Building Our AI Future. He is an IEEE Fellow, Associate Editor of many top-tier AI journals, e.g., Information Fusion and IEEE Transactions on Affective Computing, and is involved in various international conferences as keynote speaker, program chair and senior program committee member.",A
66,Ke Yiping Kelly,Computer Science and Engineering,"['https://personal.ntu.edu.sg/ypke', 'https://orcid.org/0000-0001-9473-3202']",https://dr.ntu.edu.sg/cris/rp/fileservice/rp00908/57/?filename=Yiping Ke_1.jpg,37291.0,[],"['Graph Learning', 'Graph Analytics', 'Graph Mining']","Dr. Yiping Ke is an Associate Professor with the School of Computer Science and Engineering, Nanyang Technological University. She obtained her Ph.D. degree in Computer Science from the Hong Kong University of Science and Technology in 2008 and B.Sc. degree in Computer Science from Fudan University in 2003. Before joining NTU, she was a scientist with the Institute of High Performance Computing, A*STAR and a Research Assistant Professor at the Chinese University of Hong Kong. Her experience has spanned over both academia and industry. She has published over 60 research papers in prestigious journals/conferences, receiving over 3,000 citations. She has served as program committee members and journal reviewers for ICML, NIPS, ICLR, UAI, IJCAI, AAAI, KDD, VLDB, ICDM, SDM, CIKM, ACM TKDD, IEEE TNNLS, IEEE TKDE, VLDBJ, Machine Learning Journal, etc. She has filed 6 US/UK patents with industrial partners. She has secured and managed 9 research grants and industrial funds, and successfully rolled out developed technologies to a variety of domains including engineering design, neuroscience, education, etc.",A*
67,Anupam Chattopadhyay,"Computer Science and Engineering, Electrical and Electronic Engineering, Microelectronics & Applications, Nanotechnology & Nano-Science, Security Studies & Policy Issues, Computing Hardware and Architecture, Hardware and Embedded Systems, Quantum Technology",['https://scholar.google.co.in/citations?user=TIt4ggwAAAAJ&hl=en'],https://dr.ntu.edu.sg/cris/rp/fileservice/rp01076/57/?filename=anupam_1_2.JPG,6184.0,"['Nanyang Technological University, Singapore', 'RWTH Aachen University, Germany']","['Computer Architecture', 'Electronic Design Automation', 'Hardware Security', 'Emerging Technologies', 'CPS Security']","Anupam Chattopadhyay received his B.E. degree from Jadavpur University, India, MSc. from ALaRI, Switzerland and PhD from RWTH Aachen in 2000, 2002 and 2008 respectively. From 2008 to 2009, he worked as a Member of Consulting Staff in CoWare R&D, Noida, India. From 2010 to 2014, he led the MPSoC Architectures Research Group in RWTH Aachen, Germany as a Junior Professor. Since September, 2014, Anupam was appointed as an Assistant Professor in SCSE, NTU, where he got promoted to Associate Professor with Tenure from August, 2019. In the past, he held visiting positions at Politecnico di Torino, Italy; EPFL, Switzerland; Technion, Israel and Indian Statistical Institute, Kolkata.During his doctoral studies, he worked on automatic RTL generation from the architecture description language LISA, which led to a spin-off, and subsequently was acquired by a leading EDA vendor. He developed novel high-level optimisations, verification techniques, and proposed a language-based modelling, exploration and design framework for partially re-configurable processors - many of which resulted in successful technology transfers to the EDA and Semiconductor IP industry. Anupam currently heads a team of 20+ researchers, overseeing projects in the area of computer architectures, security, design automation and emerging technologies. His research advances has been reported in more than 100 conference/journal papers (ACM/IEEE/Springer), multiple research monographs and edited books (CRC, Springer) and open-access forums. Together with his doctoral students, Anupam proposed novel research directions like, domain-specific high-level synthesis for cryptography, high-level reliability estimation flows for embedded processors, generalisation of classic linear algebra kernels and multi-layered coarse-grained reconfigurable architecture. Anupam’s research in the area of emerging technologies has been covered by major news outlets across the world, including Asian Scientist, Straits Times and The Economist.Anupam regularly serves in the TPCs of top conferences, reviews journal/ conference articles and presented multiple invited seminars/tutorials in prestigious venues. He is a series editor of Springer book series on Computer Architecture and Design Methodologies. He is a member of ACM and a senior member of IEEE.Anupam received Borcher's plaque from RWTH Aachen, Germany for outstanding doctoral dissertation in 2008, nomination for the best IP award in the ACM/IEEE DATE Conference 2016 and nomination for the best paper award in the International Conference on VLSI Design 2018.",B
68,Lin ShangWei,"Computer Science and Engineering, Cyber Security and Forensics",['https://personal.ntu.edu.sg/shang-wei.lin/'],https://dr.ntu.edu.sg/cris/rp/fileservice/rp00861/57/?filename=shang-wei.lin_1_2.JPG,1650.0,"['Nanyang Technological University, College of Engineering, Singapore', 'National Chung Cheng University, Chiayi, Taiwan']","['Formal Methods', 'Compositional Verification', 'Program Verification', 'Software Analysis']","Dr. LIN Shang-Wei received his B.S. degree in Information Management from National Chung Cheng University in 2003 and received his Ph.D. degree in Computer Science and Information Engineering from the National Chung Cheng University in 2010.In 2011, he was a postdoctoral research fellow in School of Computing, National University of Singapore. From 2012 to 2014, he was a research scientist at Temasek Laboratories in National University of Singapore. From December 2014 to April 2015, he was a postdoctoral research fellow in Singapore University of Technology and Design. He joined School of Computer Engineering in Nanyang Technological University as Assistant Professor in May 2015.",B
69,Tan Rui,"Computer Science and Engineering, Info-Communication Technology, Energy, Internet & Communications, Computer Networks and Communications","['https://personal.ntu.edu.sg/tanrui/', 'https://researchdata.ntu.edu.sg/dataverse/tanrui', 'https://ntuiot.xyz/']",https://dr.ntu.edu.sg/cris/rp/fileservice/rp00504/57/?filename=Assoc Prof Tan Rui.JPG,4244.0,[],"['Sensing', 'security', 'Internet of Things', 'cyber-physical systems']","Rui Tan received B.S.(2004) and M.S.(2007) in automation from Shanghai Jiao Tong University, and Ph.D.(2010) in computer science from City University of Hong Kong, respectively. From 2010 to 2012, he worked as a postdoctoral Research Associate at Michigan State University. From 2012 to 2015, he worked as a Research Scientist and then a Senior Research Scientist at Advanced Digital Sciences Center, a Singapore-based research center of the University of Illinois at Urbana-Champaign. He joined the School of Computer Science and Engineering (SCSE) of Nanyang Technological University (NTU) in 2016. He is currently an Associate Professor with SCSE, NTU.He has received multiple research awards including Best Paper Award from ACM/IEEE IPSN 2017, CPSR-SG 2017, Distinguished TPC Member of INFOCOM 2017, Best Paper Award Runner-Ups from ACM/IEEE IPSN 2014 and IEEE PerCom 2013, IPSN'21 Best Artifact Award Runner-Up, as well as Outstanding Academic Performance Award from City University of Hong Kong in 2009. He is now an IEEE Senior Member.",A*
70,Oh Hong Lye,Computer Science and Engineering,,https://dr.ntu.edu.sg/cris/rp/fileservice/rp00131/57/?filename=hloh_1_2.JPG,223.0,[],['Computer Science and Engineering'],"Prior to joining NTU, Oh Hong Lye worked in the semiconductor industry for 20 years in Application and R&D job functions, covering a wide range of embedded system and wireless connectivity related products in consumer, computer and industrial segments.  As part of his job function, he interacts frequently with product R&D and project management teams from Multinational, Small & Medium Enterprises and Start-up companies, both locally and oversea in US, Europe and Asia.  He is also one of the pioneers of the Texas Instruments Asia Technical Training Organisation and the first Mentor workshop instructor in Asia.  As a result of his significant contribution to the company share-holder value and technical community.  He is elected to the technical ladder of Senior Member of the Technical Staff in Texas Instruments.He holds three patents from his work done in Video Compression Algorithm when in STMicroelectronics Asia Pacific.  In NTU, his research interests includes embedded system and wireless connectivity.  The research projects he is involved in are the Singapore Millennium Foundation Grant: “Think on Your Feet - Learning through Purposeful Collaborative Play and Movement”, which uses wireless connectivity technology to enable purposeful play targeted initially at special needs students, and SCALE@NTU: “Lost and Found: Localisation”, a project that uses various outdoor and indoor localisation technologies to enable effective detection and intervention of Dementia Patients who are lost or wandering.He is currently the Assistant Chair (Student Care) and has previously served as the Chair for the SCSE Outreach Committee from 2018-2020.  He is awarded the Nanyang Education Awards (School) in 2019.",C
71,Pan Sinno Jialin,Computer Science and Engineering,['https://personal.ntu.edu.sg/sinnopan/'],https://dr.ntu.edu.sg/cris/rp/fileservice/rp00122/57/?filename=cut.JPG,37255.0,"['Nanyang Technological University, Singapore']",['Computer Science and Engineering'],"Dr. Sinno Jialin Pan is a Provost's Chair Professor at the School of Computer Science and Engineering at Nanyang Technological University (NTU), Singapore. He received his Ph.D. degree in computer science from the Hong Kong University of Science and Technology (HKUST) in 2011. Prior to joining NTU, he was a scientist and Lab Head of text analytics with the Data Analytics Department, Institute for Infocomm Research, Singapore. He joined NTU as a Nanyang Assistant Professor in 2014 and was promoted to Associate Professor and Professor in 2019 and 2022, respectively. He was appointed as a Provost's Chair in Computer Science and Engineering in 2019. He was named to the list of ""AI 10 to Watch"" by the IEEE Intelligent Systems magazine in 2018. He serves as an Associate Editor for IEEE TPAMI, AIJ, and ACM TIST. His research interests include transfer learning and its real-world applications.",A*
72,Joty Shafiq Rayhan,"Computer Science and Engineering, Linguistics and Multilingual Studies",['https://raihanjoty.github.io/'],https://dr.ntu.edu.sg/cris/rp/fileservice/rp00319/57/?filename=Assoc Prof Joty Shafiq Rayhan.JPG,8252.0,"['Salesforce AI Research, Palo Alto, CA, USA', 'Nanyang Technological University, Singapore', 'Hamad Bin Khalifa University, Qatar Computing Research Institute, Qatar', 'University of British Columbia, Department of Computer Science, Vancouver, Canada']","['Computer Science and Engineering', 'Linguistics and Multilingual Studies']","Assistant Professor, Nanyang Technological University (NTU), Singapore [Jul'17 - ]Research Scientist, Qatar Computing Research Institute (QCRI), Doha [Jan'14 - Jul'17]PhD in Computer Science, University of British Columbia (UBC), Vancouver [Sep'08 - Dec'13]MSc in Computer Science, University of Lethbridge (UofL), Lethbridge [Sep'06 - Aug'08]",A*
73,Li Mo,"Computer Science and Engineering, Internet & Communications, Computer Networks and Communications, Internet of Things","['https://personal.ntu.edu.sg/limo', 'https://orcid.org/0000-0002-6047-9709']",https://dr.ntu.edu.sg/cris/rp/fileservice/rp00937/57/?filename=potrait.jpg,11400.0,"['Nanyang Technological University, School of Computer Science and Engineering, Singapore', '李默', 'Hong Kong University of Science and Technology']","['Computer Science and Engineering', 'Internet & Communications', 'Computer Networks and Communications', 'Internet of Things']","Dr. Mo Li is a Professor in School of Computer Science and Engineering. He received his BS degree in Department of Computer Science and Technology from Tsinghua University, and the PhD degree in Department of Computer Science and Engineering from Hong Kong University of Science and Technology. Dr. Mo Li has been internationally recognized for his research in wireless sensing and networking, IoT for smart cities and urban informatics. Dr. Li received Nanyang Research Award (Young Investigator) in 2016, a prestigious recognition to his research excellence by NTU. Dr. Li is a Distinguished Member of the ACM since 2019, and a Fellow of the IEEE since 2020.",A
74,Guan Cuntai,"Computational Intelligence, Brain Machine Interface, Artificial and Augmented Intelligence, Biomedical Informatics and Data Science, Machine Learning, Neural Signal Processing, Medical Image Analysis",['https://personal.ntu.edu.sg/ctguan'],https://dr.ntu.edu.sg/cris/rp/fileservice/rp01023/57/?filename=ctguan.jpg,23544.0,"['Nanyang Technological University, School of Computer Science and Engineering, Singapore', 'Southeast University, Nanjing, China']","['Brain-Computer Interfaces', 'Brain-Machine Interfaces', 'Machine Learning', 'Medical Image Analysis', 'Digital Mental Health']","Prof Guan is a President's Chair Professor in Computer Science and Engineering at Nanyang Technological University (NTU), Singapore. He is the Director of the Artificial Intelligence Research Institute (AI.R) of NTU. He is the Co-Director, S-Lab for Advanced Intelligence (S-Lab), NTU. He is the Director of the Centre for Brain-Computing Research (CBCR). He initiated and served as the Co-Director of the Rehabilitation Research Institute of Singapore (RRIS), 2015-2018. Prior to joining NTU in 2016, he was the founding Department Head of the Neural & Biomedical Technology Department at the Institute for Infocomm Research (I2R), Agency for Science, Technology, and Research (A*SATR), Singapore.  His research interests are in the fields of Brain-Computer Interfaces (BCI), Machine Learning, Neural Signal & Image Processing, Data Analytics, and Artificial Intelligence. He published 400 refereed journal and conference papers and holds 25 granted patents and patent applications. He licensed 15 patents/technologies to five companies in Singapore and USA. He delivered more than 70 keynote speeches and invited talks (including the keynote, Brain-Computer Interfaces for Stroke Rehabilitation, at the opening ceremony of the 7th International BCI Meeting, Asilomar, USA, May 2018). He is a recipient of the Annual BCI Research Award, the King Salman Award for Disability Research, the IES Prestigious Engineering Achievement Award, the Achiever of the Year (Research) Award, the Finalist of the President Technology Award, and the winner of BCI Competitions. He has been an Associate Editor for IEEE Transactions on Biomedical Engineering, IEEE Transactions on Artificial Intelligence, Pattern Recognition, Neurocomputing, Brain-Computer Interfaces, Frontiers in Neuroscience, Frontiers in Human Neuroscience, etc. He is on the Advisory Board of IEEE Open Access Journal of Engineering in Medicine and Biology (OJEMB). He was on the IEEE Fellow Evaluation Committee for EMBS Society. He was an APSIPA Distinguished Lecturer, 2017-2018.  He served as the General Co-Chair for IEEE ICAA’2018, Conference Chair for the Internet of Things (IoT) Asia 2015, and General Chair for the IEEE HealthCom 2008. He was the President of the Pattern Recognition and Machine Intelligence Association (PREMIA), Singapore, 2008-2010.He is an elected Fellow of the Singapore Academy of Engineering (SAEng), Fellow of NAI (National Academy of Inventors, USA), Fellow of IEEE (the Institute of Electrical and Electronics Engineers), and Fellow of AIMBE (the American Institute for Medical and Biological Engineering).",B
75,Liu Ziwei,Computer Science and Engineering,['https://liuziwei7.github.io/'],https://dr.ntu.edu.sg/cris/rp/fileservice/rp00203/57/?filename=Asst Prof Liu Ziwei.JPG,30028.0,"['Nanyang Technological University, S-Lab, Singapore', 'Chinese University of Hong Kong, Department of Information Engineering, Hong Kong']","['Computer Vision', 'Machine Learning', 'Computer Graphics']","Ziwei Liu is currently a Nanyang Assistant Professor at School of Computer Science and Engineering (SCSE) in Nanyang Technological University (NTU). Previously, he was a senior research fellow (2018-2020) at the Chinese University of Hong Kong with Prof. Dahua Lin. Before that, he was a postdoctoral researcher (2017-2018) at University of California, Berkeley, working with Prof. Stella Yu. Ziwei received his PhD from the Chinese University of Hong Kong in 2017, under the supervision of Prof. Xiaoou Tang and Prof. Xiaogang Wang. During his PhD, Ziwei had the privilege of interning at Microsoft Research and Google Research, where he developed Microsoft Pix and Google Clips. His research revolves around computer vision/graphics, machine learning, and robotics. He has published over 50 papers on top-tier conferences and journals in relevant fields, including CVPR, ICCV, ECCV, AAAI, IROS, SIGGRAPH, T-PAMI, TOG, and Nature - Scientific Reports. He is the recipient of Microsoft Young Fellowship, Hong Kong PhD Fellowship, ICCV Young Researcher Award, and HKSTP best paper award. He has won the championship in major computer vision competitions, including DAVIS video segmentation challenge 2017, MSCOCO instance segmentation challenge 2018, and FAIR self-supervision challenge 2019. He is also the lead contributor of several renowned computer vision benchmarks and softwares, including CelebA, DeepFashion, mmdetection and mmfashion.",A*
76,Li Boyang,Computer Science and Engineering,['http://www.boyangli.org'],https://dr.ntu.edu.sg/cris/rp/fileservice/rp01289/57/?filename=Assoc Prof Li Boyang.png,1956.0,"['Hong Kong Polytechnic University, Kowloon, Hong Kong', 'University of Edinburgh, School of Engineering, UK', 'Nanyang Technological University, Air Traffic Management Research Institute, Singapore']","['Artificial Intelligence', 'Narrative Intelligence', 'Multimodal Learning', 'Machine Learning', 'Storytelling']","Dr. Li Boyang, Albert is a Nanyang Associate Professor at the School of Computer Science and Engineering, Nanyang Technological University. Before joining SCSE, he held a visiting position at the Alibaba-NTU Singapore Joint Research Institute. Prior to that, he was a Senior Research Scientist at Baidu Research USA from 2018 to 2019, and a Research Scientist and Group Leader at Disney Research Pittsburgh from 2015 to 2017. He received his Ph.D. degree in Computer Science from Georgia Institute of Technology in 2014, and his B.Eng. degree from Nanyang Technological University in 2008. He published more than 45 peer-reviewed papers in top-tier journals and conferences, and holds two US patents. His research work has been covered by influential technology media outlets such as Engadget, TechCrunch, New Scientist, and National Public Radio.",B
77,Luu Anh Tuan,Computer Science and Engineering,['https://tuanluu.github.io/'],https://dr.ntu.edu.sg/cris/rp/fileservice/rp01296/57/?filename=Asst Prof Luu Anh Tuan.jpg,4168.0,[],"['AI', 'NLP', 'Pretrained Language Model', 'Robustness & TrustworthyInformation …']","Luu Anh Tuan is an Assistant Professor in the School of Computer Science and Engineering (SCSE) at Nanyang Technological University, Singapore. He received his MSc degree from National University of Singapore in 2011 and Ph.D. degree from Nanyang Technological University in 2017. He was a Post-doctoral Research Fellow at Massachusetts Institute of Technology (MIT) from 2018 to 2020 under the supervision of Professor Regina Bazillay. Prior to that, he was a Research Scientist at Institute for Infocomm Research (I2R), A*STAR from 2016 to 2018.Tuan's research interests lie in the intersection of Artificial Intelligence, Deep Learning, and Natural Language Processing. He has published over 40 papers on top-tier conferences and journals including NeurIPS, ICLR, ACL, EMNLP, KDD, WWW, TACL, AAAI, etc. Tuan also served as the Senior Area Chair of EMNLP 2020, Area Chair of ACL 2021, Senior Program Committee of IJCAI 2020-2021, and Program Committee member of NeuIPS, ICLR, ICML, AAAI, etc. and standing reviewer of Transaction of ACL (TACL), Computational Linguistics (CL), Transactions on Knowledge and Data Engineering (TKDE), ACM Computing Surveys. He is a recipient of the Ministry of Trade and Industry (MTI) Singapore Innovation Award in 2013.",A*
